movie_id,movie,director,stars,country,url,release_year,released,plot
20,Final Impact,Joseph Merhi,"Lorenzo Lamas, Kathleen Kinmont, Gary Daniels",United States,//upload.wikimedia.org/wikipedia/en/thumb/1/13/Final_Impact.jpg/220px-Final_Impact.jpg,1991,1991,"Ex-world champion, Nick takes lightweight kickboxer, Danny under his wing. After being dethroned by Joe, Nick must prepare Danny in Las Vegas for a battle he lost to the same fighter which led to alcoholism and the loss of his girlfriend Maggie."
298,The Legend II (Fong Sai-yuk II),Corey Yuen,"Jet Li, Sibelle Hu, Amy Kwok",Hong Kong,//upload.wikimedia.org/wikipedia/en/thumb/9/95/Fong_sai_yuk_2_dvd.jpg/220px-Fong_sai_yuk_2_dvd.jpg,1993,7/30/1993,"The Cantonese hero Fong Sai Yuk becomes involved in the secret brotherhood ""The Red Flower"", who are trying to overthrow the Manchurian emperor and re-establishing the Ming dynasty. The social upheaval is combined with Sai Yuk's personal moral conflict about how to conform to the rigid regime of the brotherhood and on top of that sort out his difficult love life, saddled with two presumptive wives."
33,The Heroic Trio,Johnnie To,"Maggie Cheung, Michelle Yeoh, Anita Mui",Hong Kong,//upload.wikimedia.org/wikipedia/en/thumb/b/b8/TheHeroicTrio.jpg/220px-TheHeroicTrio.jpg,1993,2/12/1993,"In Hong Kong, babies are being kidnapped by the Invisible Woman (Michelle Yeoh) for the Evil Master (Yee Kwan Yan), who plans to raise them to become unbeatable warriors. The Invisible Woman's sister, Tung (Anita Mui), married to the police officer investigating the kidnappings, secretly fights crime as Wonder Woman. When the Invisible Woman reconnects with her sister and her childhood friend, Thief Catcher (Maggie Cheung), they convince her to team up with them to defeat the Evil Master."
325,The Expert,William Lustig,"Jeff Speakman, James Brolin, Jim Varney",United States,//upload.wikimedia.org/wikipedia/en/thumb/1/11/Expert95poster.jpg/220px-Expert95poster.jpg,1995,4/6/1995,The Expert/Film synopsis A special forces instructor (Jeff Speakman) gets revenge on the prison inmate who murdered his sister.
42,Bounty Tracker,Kurt Anderson,"Lorenzo Lamas, Matthias Hues, Cyndi Pass",GermanyUnited States,"https://ia.media-imdb.com/images/M/MV5BMTE5OTM2OTMxNF5BMl5BanBnXkFtZTYwMzA3MjA5._V1_UY1200_CR14,0,630,1200_AL_.jpg",1993,9/8/1993,"The staff in a tax consultant office is brutally murdered by a team of professional killers. Only Paul Damone escapes. Paul didn't know that his partner, Greco, used to launder money for gangster, and was to testify as a chief witness at his upcoming trial. Paul's brother, Johnny, is the best bounty tracker in Boston. He visit's Paul, only to find his brother's house surrounded by police assigned to protect him. When those who don't want him to testify kill Paul, Johnny tracks down the killer."
351,A Hero Never Dies,Johnnie To,"Leon Lai, Lau Ching-Wan, Fiona Leung",Hong Kong,//upload.wikimedia.org/wikipedia/en/thumb/0/0a/A-hero-never-dies-poster.jpg/220px-A-hero-never-dies-poster.jpg,1998,9/30/1998,Jack (Leon Lai) and Martin (Ching-Wan Lau) are gunmen who work for two rival kingpins. Jack and Martin have been fighting on their bosses behalf for close to a year. When a truce is made both Jack and Martin are cut loose. The two men then decide to join forces and take on the gangsters who used them.
56,Point of No Return,John Badham,"Bridget Fonda, Gabriel Byrne, Dermot Mulroney",United States,//upload.wikimedia.org/wikipedia/en/thumb/c/c9/Pointofnoreturn.jpg/220px-Pointofnoreturn.jpg,1993,3/19/1993,"Louis Stevens' (Mark Dacascos) service as a member of an elite military unit kept him out of the country for several years. Now that he's back home in Florida, he's dismayed at what's become of his old high school. He sees that drug dealers, dispatched by local overlord Silverio (Paco Christian Prieto), sell on school grounds with little fear of getting caught. A skilled martial artist, Louis is determined to end the drug peddling, but to do so he'll probably have to duke it out with Silverio."
55,Only the Strong,Sheldon Lettich,"Mark Dacascos, Stacey Travis, Geoffrey Lewis",United States,//upload.wikimedia.org/wikipedia/en/thumb/c/ca/Only_the_Strong.jpg/220px-Only_the_Strong.jpg,1993,8/27/1993,"Louis Stevens' (Mark Dacascos) service as a member of an elite military unit kept him out of the country for several years. Now that he's back home in Florida, he's dismayed at what's become of his old high school. He sees that drug dealers, dispatched by local overlord Silverio (Paco Christian Prieto), sell on school grounds with little fear of getting caught. A skilled martial artist, Louis is determined to end the drug peddling, but to do so he'll probably have to duke it out with Silverio."
85,Don't Give a Damn,Sammo Hung,"Sammo Hung, Yuen Biao",Hong Kong,//upload.wikimedia.org/wikipedia/en/thumb/4/49/DontGiveaDamn.jpg/220px-DontGiveaDamn.jpg,1995,2/17/1995,"Sammo Hung plays a cop on the trail of drug dealers. Customs officer Yuen Biao is investigating the same gang. Sammo’s new partner is eager-beaver Takeshi Kaneshiro. Despite each having their own ideas on how best to proceed, they are teamed together and must put aside their differences in order to crack the case. Romance, plot twists, comedic asides, and, of course, plenty of fights bring the film to a climatic and bruising conclusion"
94,Mortal Kombat,Paul W.S. Anderson,"Robin Shou, Linden Ashby, Bridgette Wilson",United States,//upload.wikimedia.org/wikipedia/en/thumb/f/fb/Mortal_Kombat_poster.jpg/220px-Mortal_Kombat_poster.jpg,1995,8/18/1995,"Lord Rayden (Christopher Lambert) handpicks three martial artists -- federal agent Sonya Blade (Bridgette Wilson), Shaolin monk Lui Kang (Robin Shou) and action movie sensation Johnny Cage (Linden Ashby) -- and mentors them. After intense training, Rayden transports the trio to Outworld, the site of an inter-dimensional fighting tournament. There, the three humans must defeat the demonic warriors of the evil Shang Sung (Cary-Hiroyuki Tagawa) -- or allow Sung to take over the Earth."
14,Peacemaker,Kevin S. Tenney,"Robert Forster, Lance Edwards, Hilary Shepard",United States,//upload.wikimedia.org/wikipedia/en/thumb/f/f6/Peacemaker_%281990_film%29_cover.jpg/220px-Peacemaker_%281990_film%29_cover.jpg,1990,7/2/1990,"Two trains collide in rural Russia, one of them housing nuclear weapons that go missing after the wreck, and the U.S. government is alerted. Nuclear specialist Dr. Julia Kelly (Nicole Kidman) believes that there will soon be a terrorist attack, so Lt. Col. Thomas Devoe (George Clooney) joins Dr. Kelly as they try to track down the warhead-stealing culprits. They learn that Yugoslav terrorist Gavrich (Marcel Iures) has his hands on the weapons, and he's plotting a devastating attack on New York"
122,Lifeline,Johnnie To,"Lau Ching-Wan, Alex Fong Chung-sun, Ruby Wong",Hong Kong,//upload.wikimedia.org/wikipedia/en/thumb/7/7b/Lifelinefilm.jpg/220px-Lifelinefilm.jpg,1997,1/3/1997,"A heroic but cocky firefighter pays no regard to the dangers of the job but lacks the courage to face his personal demons. When faced with a giant and volatile inferno, he must put aside personal differences with his boss if they are both to survive."
134,Ballistic Kiss,Donnie Yen,"Donnie Yen, Annie Wu, Jimmy Wong",Hong Kong,//upload.wikimedia.org/wikipedia/en/thumb/1/1c/BallisticKiss.jpg/220px-BallisticKiss.jpg,1998,3/21/1998,Ballistic Kiss/Film synopsis A cop-turned-contract-killer (Donnie Yen) kidnaps a policewoman (Annie Wu) out to arrest him and falls in love with her.
157,Nowhere to Hide,Lee Myung-se,"Ahn Sung-ki, Park Joong-hoon, Jang Dong-gun",South Korea,//upload.wikimedia.org/wikipedia/en/thumb/d/d7/Nowhere_to_Hide.jpg/220px-Nowhere_to_Hide.jpg,1999,7/31/1999,"As Inchon citizens run for cover in the pouring rain, a mysterious man walks up Forty Steps and stabs another man to death. He disappears with a briefcase full of cash while his accomplices finish off the dead man's subordinate. The initial police investigation reveals an underground drug world at war. A detective addicted to his job and works by instinct leads the investigation."
169,The Swordsman,"King Hu, Ching Siu-Tung, Ann Hui, Andrew Kam, Tsui Hark","Sam Hui, Jacky Cheung, Cecilia Yip, Sharla Cheung",Hong Kong,//upload.wikimedia.org/wikipedia/en/thumb/0/08/The-Swordsman-poster.jpg/220px-The-Swordsman-poster.jpg,1990,4/5/1990,"A young swordsman inadvertently takes delivery of a sacred scroll, which has been stolen from the Emperor's library. The scroll, said to contain the details of a secret martial arts technique, is sought by a number of groups including the army, a martial arts school, and a tribe of snake-wielding women."
215,My Father Is a Hero,Corey Yuen,"Jet Li, Anita Mui, Tsue Miu",Hong Kong,//upload.wikimedia.org/wikipedia/en/thumb/e/ea/My-Father-is-a-Hero-poster.jpg/220px-My-Father-is-a-Hero-poster.jpg,1995,3/2/1995,"Johnny (Xie Miao) is a junior kung fu champ growing up in China. He's been told his father, Wei (Jet Li), is a dangerous criminal. He's really an undercover agent infiltrating the Hong Kong Triad. When a brazen cop, Inspector Fong (Anita Mui), sets out to bring down the gang, she investigates Wei's mainland past and uncovers his true identity. After Wei's gravely ill wife dies, Fong takes Johnny back to Hong Kong with her, and father, son and cop team up to bring down a criminal empire."
178,Tiger Claws,Kelly Makin,"Jalal Merhi, Cynthia Rothrock",Canada,//upload.wikimedia.org/wikipedia/en/thumb/c/cf/Tiger-claws.jpg/220px-Tiger-claws.jpg,1992,7/16/1992,"Clawed corpses clue police detectives (Jalal Merhi, Cynthia Rothrock) to a killer of martial artists in New York."
194,Kung Fu Cult Master,Wong Jing,"Jet Li, Ekin Cheng, Sammo Hung",Hong Kong,//upload.wikimedia.org/wikipedia/en/thumb/e/e6/Kung_Fu_Cult_Master.jpg/220px-Kung_Fu_Cult_Master.jpg,1993,12/18/1993,Two different schools of kung fu fight for possession of two magic swords that will let the owner know all martial-arts secrets.
206,Street Fighter II: The Animated Movie,Gisaburo Sugii,NULL,JapanUnited States,//upload.wikimedia.org/wikipedia/en/thumb/0/0f/Street_Fighter_II_The_Animated_Movie_%28Japanese_pamphlet%29.JPG/220px-Street_Fighter_II_The_Animated_Movie_%28Japanese_pamphlet%29.JPG,1994,8/6/1994,"n this animated film, M. Bison (Jôji Nakata), leader of the international crime syndicate Shadowlaw, is recruiting the world's greatest fighters. Bison targets Japanese fighting master Ryu (Kôjirô Shimizu), who possesses gravity-defying abilities. Unable to coerce Ryu, Bison captures and converts Ken Masters (Kenji Haga), an ex-classmate who shares Ryu's fighting style. Meanwhile, Chun-Li (Miki Fujitani) of Interpol teams with an American soldier (Masatane Tsukayama) to crush Shadowlaw."
216,The Blade,Tsui Hark,"Vincent Zhao, Moses Chan, Xiong Xinxin",Hong Kong,//upload.wikimedia.org/wikipedia/en/thumb/f/f1/The-Blade-poster.jpg/220px-The-Blade-poster.jpg,1995,12/21/1995,"After the master of the Sharp Manufacturer saber factory abdicates and appoints On, his least popular worker, as his successor, On, unwilling to lead his surly colleagues, embarks on a quest of revenge to kill the evil, flying, tattooed kung fu master who killed his father."
236,Razor Blade Smile,Jake West,"Eileen Daly, Christopher Adamson, Heidi James",United Kingdom,//upload.wikimedia.org/wikipedia/en/thumb/1/18/RazorBladeSmile.jpg/220px-RazorBladeSmile.jpg,1998,9/19/1998,"A vampire (Eileen Daley), a holdover from the 19th century, meets many lovers and victims in her job as a hit woman."
238,The Substitute 2: School's Out,Steve Pearl,"Treat Williams, B.D. Wong, Lawrence Gilliard, Jr.",United States,//upload.wikimedia.org/wikipedia/en/d/d3/The_Substitute_2_-_School%27s_Out_%28DVD_cover_art%29.jpg,1998,8/1/1998,"A mercenary with a chip on his shoulder, Karl Thomasson (Treat Williams) poses as a teacher at an inner-city school to exact revenge on the gang members who murdered his brother. As Thomasson investigates the killing and tries to keep his estranged niece, Anya (Susan Pratt), safe, he begins to realize how dysfunctional and violent the urban school environment has become. Even with support from fellow soldier Joey Six (Angel David), Thomasson is seriously outnumbered as he seeks vengeance."
278,King of Beggars,Gordon Chan,Stephen Chow,Hong Kong,//upload.wikimedia.org/wikipedia/en/thumb/b/ba/KingofBeggars.jpg/220px-KingofBeggars.jpg,1992,12/17/1992,"The spoilt son of a millionaire finds the love of his life, but she will only accept him if he proves himself as a kung-fu master. He enters and wins the ""Kung-Fu Scholar"" tournament, little realizing that this victory will lead to him becoming penniless, homeless and sleepy. One day, while sleeping under a tree, he encounters a beggar he helped when he was still rich."
6,Delta Force 2: The Colombian Connection,Aaron Norris,"Chuck Norris, Billy Drago, Bobby Chavez",United States,//upload.wikimedia.org/wikipedia/en/thumb/e/e1/Deltaforce2.jpg/220px-Deltaforce2.jpg,1990,8/24/1990,"When DEA agents are taken captive by a ruthless South American kingpin, the Delta Force is reunited to rescue them in this sequel to the 1986 film."
1,"Abraxas, Guardian of the Universe",Damian Lee,"Jesse Ventura, Sven-Ole Thorsen, Damian Lee",United States,https://encrypted-tbn1.gstatic.com/images?q=tbn:ANd9GcS6r5ocHNxnSUaHmHPPKTOFS_LiNYoh2KDFCJtwOViFqcLr_8y9,1991,3/1/1991,"An alien ""policeman"" arrives on Earth to apprehend a renegade of his own race who impregnates a woman with a potentially destructive mutant embryo."
2,All for the Winner,"Corey Yuen, Jeffrey Lau","Stephen Chow, Ng Man Tat",Hong Kong,//upload.wikimedia.org/wikipedia/en/thumb/9/92/All_for_the_Winner.jpg/220px-All_for_the_Winner.jpg,1990,6/10/1990,"A man discovers that his dumb, lovable nephew can see through objects and decides to unleash him into the world of gambling."
3,Another 48 Hrs.,Walter Hill,"Nick Nolte, Eddie Murphy",United States,//upload.wikimedia.org/wikipedia/en/thumb/0/00/Another_forty_eight_hours.jpg/220px-Another_forty_eight_hours.jpg,1990,6/8/1990,"Jack Cates once again enlists the aid of ex-con Reggie Hammond--this time, to take down The Iceman, a ruthless drug lord operating in the San Francisco bay area."
4,Captain America,Albert Pyun,Matt Salinger,United StatesYugoslavia,//upload.wikimedia.org/wikipedia/en/thumb/d/d6/Poster_for_the_1990_Captain_America_movie.jpg/220px-Poster_for_the_1990_Captain_America_movie.jpg,1990,12/14/1990,"Frozen in the ice for decades, Captain America is freed to battle against archcriminal The Red Skull."
5,Darkman,Sam Raimi,"Liam Neeson, Frances McDormand",United States,//upload.wikimedia.org/wikipedia/en/thumb/3/3e/Darkman_film_poster.jpg/200px-Darkman_film_poster.jpg,1990,8/24/1990,A brilliant scientist left for dead returns to exact revenge on the people who burned him alive.
7,Dick Tracy,Warren Beatty,"Warren Beatty, Madonna",United States,//upload.wikimedia.org/wikipedia/en/9/9d/Dick_tracy1.jpg,1990,6/14/1990,The comic strip detective finds his life vastly complicated when Breathless Mahoney makes advances towards him while he is trying to battle Big Boy Caprice's united mob.
8,Hard to Kill,Bruce Malmuth,"Steven Seagal, Kelly Le Brock, Bill Sadler",United States,//upload.wikimedia.org/wikipedia/en/thumb/f/f2/Hard_To_Kill.jpg/220px-Hard_To_Kill.jpg,1990,2/9/1990,"Left for dead with his wife killed in their house, L.A. Detective Mason Storm will have to make a quick recovery, expose those behind the murder and take revenge."
10,Lionheart,Sheldon Lettich,Jean-Claude Van Damme,United States,//upload.wikimedia.org/wikipedia/en/thumb/7/72/Lion-Heart-Poster.jpg/220px-Lion-Heart-Poster.jpg,1991,1/11/1991,An Ex-French Soldier begins participating in underground street fights in order to make money for his brother's family.
11,Maniac Cop 2,William Lustig,"Robert Davi, Claudia Christian, Michael Lerner",United States,//upload.wikimedia.org/wikipedia/en/thumb/7/7e/Maniacop2pos1.jpg/220px-Maniacop2pos1.jpg,1990,1990,"A supernatural, maniac killer cop teams up with a Times Square serial killer."
12,Marked for Death,Dwight H. Little,"Steven Seagal, Basil Wallace, Keith David",United States,//upload.wikimedia.org/wikipedia/en/thumb/9/99/Marked_For_Death_film.jpg/220px-Marked_For_Death_film.jpg,1990,10/5/1990,A retired DEA agent is out to hunt down and take out a Jamaican drug posse that has targeted he and his family for murder.
13,Narrow Margin,Peter Hyams,"Gene Hackman, Anne Archer, James B. Sikking",United States,//upload.wikimedia.org/wikipedia/en/thumb/3/30/Narrow_Margin_1990_Poster.jpg/220px-Narrow_Margin_1990_Poster.jpg,1990,9/21/1990,A Los Angeles Deputy District Attorney is sent to protect a woman who accidentally witnessed a Mafia murder.
15,Teenage Mutant Ninja Turtles,Steven Barron,"Judith Hoag, Elias Koteas, Ray Serra",United States,//upload.wikimedia.org/wikipedia/en/thumb/8/8d/Teenage_Mutant_Ninja_Turtles_%281990_film%29_poster.jpg/220px-Teenage_Mutant_Ninja_Turtles_%281990_film%29_poster.jpg,1990,3/30/1990,"When a kingpin threatens New York City, a group of mutated turtle warriors must emerge from the shadows to protect their home."
16,The Rookie,Clint Eastwood,"Clint Eastwood, Charlie Sheen, Ra�l Juli�",United States,//upload.wikimedia.org/wikipedia/en/thumb/2/27/The_Rookie.jpg/220px-The_Rookie.jpg,1990,12/7/1990,"Starting over isn't easy, especially for John Nolan who, after a life-altering incident, is pursuing his dream of joining the LAPD. As their oldest rookie, he's met with skepticism from those who see him as just a walking midlife crisis."
17,Total Recall,Paul Verhoeven,"Arnold Schwarzenegger, Rachel Ticotin, Sharon Stone",United States,//upload.wikimedia.org/wikipedia/en/thumb/f/f9/Total_recall.jpg/220px-Total_recall.jpg,1990,6/1/1990,"When a man goes for virtual vacation memories of the planet Mars, an unexpected and harrowing series of events forces him to go to the planet for real - or is he?"
18,Black Cat,Stephen Shin,"Simon Yam, Thomas Lam, Jade Leung",Hong Kong,//upload.wikimedia.org/wikipedia/en/thumb/c/cb/Black-cat-1991-poster.jpg/220px-Black-cat-1991-poster.jpg,1991,8/17/1991,Two women are raped and killed by samurai soldiers. Soon they reappear as vengeful ghosts who seduce and brutally murder the passing samurai.
19,Fight Back to School,Gordon Chan,"Stephen Chow, Sharla Cheung, Roy Cheung",Hong Kong,//upload.wikimedia.org/wikipedia/en/thumb/3/32/Fight_Back_to_School_DVD_cover.jpg/190px-Fight_Back_to_School_DVD_cover.jpg,1991,1991,A SWAT team leader is going undercover at a high school to retrieve a stolen gun for his captain.
22,Harley Davidson and the Marlboro Man,Simon Wincer,"Mickey Rourke, Don Johnson, Chelsea Field",United States,//upload.wikimedia.org/wikipedia/en/thumb/0/04/Harley_davidson_and_the_marlboro_man_movie_poster.jpg/220px-Harley_davidson_and_the_marlboro_man_movie_poster.jpg,1991,8/23/1991,"Forced by the imminent foreclosure of their friend's bar, two lifelong buddies will decide to rob a bank's armoured car, not knowing that its cargo is not money but a new street drug."
23,Samurai Cop,Amir Shervan,"Robert Z'Dar, Mark Hannon, Mark Frazer",United States,//upload.wikimedia.org/wikipedia/en/e/e9/SamuraiCop.jpg,1991,1991,"Joe Marshall and Frank Washington are two tenacious police detectives who seek at all costs to stop the Katana, a renegade Yakuza gang composed of violent and sadistic killers who want to lead the drug trade in Los Angeles."
24,Showdown in Little Tokyo,Mark L. Lester,"Dolph Lundgren, Brandon Lee, Cary-Hiroyuki Tagawa",United States,//upload.wikimedia.org/wikipedia/en/thumb/2/2c/Showdown_in_Little_Tokyo_poster.jpg/220px-Showdown_in_Little_Tokyo_poster.jpg,1991,8/23/1991,"Two L.A. cops with opposing views on what is the best way to uphold the law have to work together to bring down the Yakuza, while trying to protect a beautiful woman."
25,Terminator 2: Judgment Day,James Cameron,"Arnold Schwarzenegger, Linda Hamilton, Edward Furlong",United States,//upload.wikimedia.org/wikipedia/en/thumb/8/85/Terminator2poster.jpg/220px-Terminator2poster.jpg,1991,7/1/1991,"A cyborg, identical to the one who failed to kill Sarah Connor, must now protect her teenage son, John Connor, from a more advanced and powerful cyborg."
26,The Human Shield,Ted Post,Michael Dudikoff,United States,//upload.wikimedia.org/wikipedia/en/a/a2/Humanshield.jpg,1991,1991,"An ex-Marine who was hired to train Iraqi soldiers to fight Iran returns to Iraq as a CIA agent to free his brother, who has been imprisoned there by a renegade general."
28,Zeram,Keita Amemiya,NULL,Japan,//upload.wikimedia.org/wikipedia/en/thumb/b/b9/Zeiram-poster.jpg/220px-Zeiram-poster.jpg,1991,1991-08,Bounty hunters Iria and Bob travel to Earth to capture an escaped bio-engineered fighting machine called Zeiramu.
29,Aces: Iron Eagle III,John Glen,"Louis Gossett Jr., Paul Freeman, Rachel McLish",United States,//upload.wikimedia.org/wikipedia/en/a/af/Aces_iron_eagle_iii.jpg,1992,1/9/1992,"Chappy discovers a drug-smuggling scheme at his own air base. It turns out that the lives of some village people in Peru are at stake, and he decides to fly there with ancient airplanes and friends to free them."
21,God of Gamblers II,Wong Jing,"Andy Lau, Stephen Chow, Ng Man Tat",Hong Kong,//upload.wikimedia.org/wikipedia/en/thumb/e/e8/GodofGamblersII.jpg/220px-GodofGamblersII.jpg,1990,12/13/1990,Gangsters plan on swindling millions while ruining the good name of the God of Gamblers.
27,The Perfect Weapon,Mark DiSalle,"Jeff Speakman, John Dye, Mako",United States,//upload.wikimedia.org/wikipedia/en/thumb/c/c0/Perfect_weapon_poster.jpg/220px-Perfect_weapon_poster.jpg,1991,1991,"An expert in ""kenpo"" karate avenges his Chinatown friend, slain by a mobster in Los Angeles."
9,I Come in Peace,Craig R. Baxley,"Dolph Lundgren, Betsy Brantley, Brian Benben",United States,//upload.wikimedia.org/wikipedia/en/thumb/0/04/IComeInPeace.DolphLundgren.jpg/220px-IComeInPeace.DolphLundgren.jpg,1990,9/28/1990,"Renegade cop Jack Caine (Dolph Lundgren) is intent on snuffing out a dangerous gang of drug traffickers known as the ""White Boys."" When the gang makes off with a cache of heroin from federal custody and destroys the building to conceal evidence of their crime, Caine investigates with straight-arrow FBI agent Arwood Smith (Brian Benben). But bizarre new clues reveal that the Boys' criminal enterprise extends much further than anyone had previously imagined."
30,Hard Boiled,John Woo,"Chow Yun-fat, Tony Leung Chiu-Wai, Anthony Wong",Hong Kong,//upload.wikimedia.org/wikipedia/en/thumb/3/38/Hard-boiled-film-poster.jpg/220px-Hard-boiled-film-poster.jpg,1992,4/16/1992,A tough-as-nails cop teams up with an undercover agent to shut down a sinister mobster and his crew.
31,Lethal Weapon 3,Richard Donner,"Mel Gibson, Danny Glover, Joe Pesci",United States,//upload.wikimedia.org/wikipedia/en/thumb/c/cc/Lethal_Weapon_3_Poster.jpg/220px-Lethal_Weapon_3_Poster.jpg,1992,5/15/1992,Martin Riggs and Roger Murtaugh pursue a former LAPD officer who uses his knowledge of police procedure and policies to steal and sell confiscated guns and ammunition to local street gangs.
32,Live Wire,Christian Duguay,"Pierce Brosnan, Ron Silver, Ben Cross",United States,//upload.wikimedia.org/wikipedia/en/thumb/9/9a/Live_Wire_%281992_film%29_poster.jpg/220px-Live_Wire_%281992_film%29_poster.jpg,1992,5/1/1992,"After A US senator is killed, A Bomb Disposal Expert is brought in to investigate the deadly explosive and must uncover the terrorists plan."
34,The Master,Tsui Hark,"Jet Li, Yuen Wah, Jerry Trimble",Hong Kong,//upload.wikimedia.org/wikipedia/en/thumb/e/ed/TheMasterPoster.jpg/220px-TheMasterPoster.jpg,1992,5/28/1992,A Naval veteran arrives home from war unsettled and uncertain of his future - until he is tantalized by the Cause and its charismatic leader.
35,Trancers III: Death Lives,C. Courtney Joyner,Ed Beechner,United States,//upload.wikimedia.org/wikipedia/en/thumb/2/2e/Trancers_III_FilmPoster.jpeg/220px-Trancers_III_FilmPoster.jpeg,1992,10/14/1992,"A time cop is sent back to the 23rd Century to finish his battle against zombie-like beings called Trancers, with the help of his wife and an ex-con."
36,Twin Dragons,"Ringo Lam, Tsui Hark","Jackie Chan, Maggie Cheung, Philip Chan",Hong Kong,//upload.wikimedia.org/wikipedia/en/thumb/8/87/Twin-Dragons-poster.jpg/220px-Twin-Dragons-poster.jpg,1992,1/15/1992,"Identical twins are separated at birth, one becoming a streetwise mechanic, and the other an acclaimed classical concert conductor. Finally meeting in adulthood, they each become mistaken for the other and entangled in each other's world."
37,Under Siege,Andrew Davis,"Steven Seagal, Tommy Lee Jones, Gary Busey",United States,//upload.wikimedia.org/wikipedia/en/thumb/3/3d/StevenSeagalUnderSiege_cover.jpg/220px-StevenSeagalUnderSiege_cover.jpg,1992,10/9/1992,An ex-Navy Seal turned cook is the only person who can stop a group of terrorists when they seize control of a U.S. battleship.
39,American Yakuza,Frank Cappello,"Viggo Mortensen, Ryo Ishibashi, Michael Nouri",United States,//upload.wikimedia.org/wikipedia/en/thumb/7/7d/American-yakuza.jpg/220px-American-yakuza.jpg,1993,12/22/1993,An American FBI agent is lured away by the Japanese Mafia--the Yakuza--in this action film.
40,Batman: Mask of the Phantasm,"Eric Radomski, Bruce Timm",NULL,United States,//upload.wikimedia.org/wikipedia/en/thumb/e/ea/Batman_mask_of_the_phantasm_poster.jpg/220px-Batman_mask_of_the_phantasm_poster.jpg,1993,12/24/1993,Batman is wrongly implicated in a series of murders of mob bosses actually done by a new vigilante assassin.
