movie_id,movie,director,stars,country,url,release_year,released,plot
271,Savior of the Soul,Corey Yuen,"Andy Lau, Anita Mui, Kenny Bee",Hong Kong,//upload.wikimedia.org/wikipedia/en/thumb/3/33/SaviouroftheSoul.jpg/220px-SaviouroftheSoul.jpg,1991,12/19/1991,"A graying black-clad swordsman slays palace guards, as he flies through the air to an uncertain purpose. Centuries (or is it days?) later, gun-toting, Armani-clad super policemen -- Hong Kong's Saviours -- are devastated by a cloaked assassin. Kinetic medieval fantasy; overstructured, outgunned urban nightmare. And that's only the first ten minutes! A highly entertaining, eye-popping genre bender in every way."
272,Stone Cold,Craig R. Baxley,"Brian Bosworth, Lance Henriksen, William Forsythe",United States,//upload.wikimedia.org/wikipedia/en/thumb/8/82/Stone-Cold-poster.jpg/220px-Stone-Cold-poster.jpg,1991,1991,A tough Alabama cop is blackmailed by the FBI into going undercover in a violent Mississippi biker gang. EN
273,Swordsmen in Double Flag Town,He Ping,"Wei Gao, Mana Zhao",China,//upload.wikimedia.org/wikipedia/en/thumb/3/32/Swordsmen_in_Double_Flag_Town_%281991%29_Film_Poster.jpg/220px-Swordsmen_in_Double_Flag_Town_%281991%29_Film_Poster.jpg,1991,1991,"A teenage lad arrives at Double Flag Town to claim his betrothed bride, when he encounters a group of outlaws and kills one of them. A vendetta is expected."
274,Teenage Mutant Ninja Turtles II: The Secret of the Ooze,Michael Pressman,"Paige Turco, David Warner, Ernie Reyes Jr.",United States,//upload.wikimedia.org/wikipedia/en/thumb/6/6c/Teenage_Mutant_Ninja_Turtles_II_%281991_film%29_poster.jpg/220px-Teenage_Mutant_Ninja_Turtles_II_%281991_film%29_poster.jpg,1991,3/22/1991,"The Turtles and the Shredder battle once again, this time for the last canister of the ooze that created the Turtles, with which Shredder wants to unleash an army of new mutants. EN"
275,The Last Boy Scout,Tony Scott,"Bruce Willis, Damon Wayans",United States,//upload.wikimedia.org/wikipedia/en/thumb/0/0d/Last_boy_scout.jpg/220px-Last_boy_scout.jpg,1991,12/13/1991,"A private detective's protected female witness is murdered, prompting him and the victim's boyfriend to investigate the crime that leads to a corrupt politician and a crooked football team owner. EN"
277,El Mariachi,Robert Rodriguez,"Carlos Gallardo, Consuelo Gomez, Reinol Martinez",United States,//upload.wikimedia.org/wikipedia/en/thumb/3/35/El-Mariachi-Poster.jpg/220px-El-Mariachi-Poster.jpg,1992,9/15/1992,A traveling mariachi is mistaken for a murderous criminal and must hide from a gang bent on killing him.
280,Passenger 57,Kevin Hooks,"Wesley Snipes, Bruce Payne, Tom Sizemore",United States,//upload.wikimedia.org/wikipedia/en/thumb/4/47/Passenger_fifty_seven.jpg/220px-Passenger_fifty_seven.jpg,1992,11/6/1992,An airline security expert must take action when he finds himself trapped on a passenger jet when terrorists seize control of it. EN
281,Patriot Games,Phillip Noyce,"Harrison Ford, Anne Archer, Sean Bean",United States,//upload.wikimedia.org/wikipedia/en/thumb/f/f2/Patriot_Games_theatrical_poster.jpg/220px-Patriot_Games_theatrical_poster.jpg,1992,6/5/1992,"When CIA analyst Jack Ryan interferes with an IRA assassination, a renegade faction targets him and his family for revenge. EN"
279,Once Upon a Time in China II,Tsui Hark,"Jet Li, Rosamund Kwan, Donnie Yen",Hong Kong,//upload.wikimedia.org/wikipedia/en/thumb/d/d8/OUATIC2.jpg/220px-OUATIC2.jpg,1992,4/16/1992,A martial arts teacher protects his students and his aunt from a fanatical cult seeking to drive the Europeans out of China.
276,CIA Code Name: Alexa,Joseph Merhi,"Lorenzo Lamas, Kathleen Kinmont, O. J. Simpson",United States,https://encrypted-tbn3.gstatic.com/images?q=tbn:ANd9GcRSh_hHh_Jp-Hxz7VARd7Q2rlaJkjHGOwwZ6JDXUhXXk4qpwL1n,1992,9/24/1992,A terrorist couple is pitted against each other when the female counterpart is captured by C.I.A. agents. They convince her to help them bring down the dangerous group in this violent actioner.
291,Stop! Or My Mom Will Shoot,Roger Spottiswoode,"Sylvester Stallone, Estelle Getty",United States,//upload.wikimedia.org/wikipedia/en/thumb/a/ae/Momshootposter.jpg/220px-Momshootposter.jpg,1992,2/21/1992,A tough police sergeant's overbearing mother comes to visit him and begins to meddle in his life and career. EN
292,Trespass,Walter Hill,"Bill Paxton, Ice-T, Bill Sadler",United States,//upload.wikimedia.org/wikipedia/en/thumb/3/30/TrespassMovie.jpg/220px-TrespassMovie.jpg,1992,12/25/1992,"As they're held for ransom, a husband and wife's predicament grows more dire amid the discovery of betrayal and deception."
293,Universal Soldier,Roland Emmerich,"Jean-Claude Van Damme, Dolph Lundgren, Ally Walker",United States,//upload.wikimedia.org/wikipedia/en/thumb/9/93/Universal_soldier_ver1.jpg/220px-Universal_soldier_ver1.jpg,1992,7/10/1992,Two rival soldiers who were killed in Vietnam are brought back to life in a top secret military experiment that creates superhuman warriors. EN
294,American Ninja V,Bobby Gene Leonard,"David Bradley, Norman Burton, Anne Dupont",United States,//upload.wikimedia.org/wikipedia/en/thumb/1/1d/American_Ninja_5.jpg/220px-American_Ninja_5.jpg,1993,7/10/1993,"When a scientists daughter is kidnapped, American Ninja (David Bradley), attempts to find her, but this time he teams up with a youngster he has trained in the ways of the ninja."
295,Best of the Best 2,Robert Radler,"Eric Roberts, Phillip Rhee, Chris Penn",United States,//upload.wikimedia.org/wikipedia/en/thumb/a/a2/Bestofthebest2.jpg/220px-Bestofthebest2.jpg,1993,3/5/1993,"In an underground fight club, blackbelt Travis Brickley is killed after losing to the evil martial arts master Brakus. Travis' death is witnessed by Walter Grady, the son of his best friend Alex Grady. Alex and his partner, Tommy Lee, vow to avenge their friend's death by defeating Brakus and shutting down the fight club. Written by Jean-Marc Rocher <rocher@fiberbit.net>"
297,Fong Sai-Yuk,Corey Yuen,"Jet Li, Josephine Siao Fong-fong",Hong Kong,//upload.wikimedia.org/wikipedia/en/thumb/e/e0/Fongsaiyuk.jpg/220px-Fongsaiyuk.jpg,1993,3/4/1993,"This Hong Kong martial-arts extravaganza tells of evil emperors and true love. The secret Red Lotus Flower Society is committed to the overthrow of the evil Manchu Emperor and his minions. One of his Governors is sent on a mission to retrieve a list of members of that secret society. Meanwhile, Canton kung fu practitioner Fong Sai-Yuk falls in love with the beautiful daughter of a rich merchant, recently moved to Canton. Her father, in an attempt to gain influence in the region and thus improve his business, offers his daughter in marriage to the winner of a kung-fu contest. Some interesting gender role-reversals take place during a 'comedy of errors.'"
299,Hard Target,John Woo,"Jean-Claude Van Damme, Lance Henriksen, Arnold Vosloo",United States,//upload.wikimedia.org/wikipedia/en/thumb/5/5c/HardTarget_1993_poster.jpg/215px-HardTarget_1993_poster.jpg,1993,8/20/1993,"A woman hires a drifter as her guide through New Orleans in search of her father, who has gone missing. They discover a deadly game of cat and mouse behind his disappearance in the process. EN"
301,Judgment Night,Stephen Hopkins,"Emilio Estevez, Cuba Gooding Jr., Denis Leary",United States,//upload.wikimedia.org/wikipedia/en/thumb/a/aa/Judgment_night_poster.jpg/220px-Judgment_night_poster.jpg,1993,10/15/1993,"Four friends on their way to a boxing match get caught in heavy traffic, so they take a shortcut in order to get there faster, unfortunately it leads to them witnessing a murder which leaves them running for their lives."
302,Last Action Hero,John McTiernan,"Arnold Schwarzenegger, Austin O'Brien, F. Murray Abraham",United States,//upload.wikimedia.org/wikipedia/en/thumb/0/0e/Last_action_hero_ver2.jpg/220px-Last_action_hero_ver2.jpg,1993,6/13/1993,"With the help of a magic ticket, a young movie fan is transported into the fictional world of his favorite action movie character."
303,Maniac Cop 3: Badge of Silence,"William Lustig, Joel Soisson","Robert Davi, Caitlin Dulany, Gretchen Becker",United States,//upload.wikimedia.org/wikipedia/en/thumb/f/f1/Maniacop3-poster.jpg/220px-Maniacop3-poster.jpg,1993,7/7/1993,"A priest practicing the Voodoo arts resurrects Matt Cordell, who takes his badge and comes back from the dead to do his bidding."
304,Street Knight,Albert Magnoli,"Jeff Speakman, Christopher Neame, Bernie Casey",United States,//upload.wikimedia.org/wikipedia/en/thumb/0/08/Poster_of_the_movie_Street_Knight.jpg/220px-Poster_of_the_movie_Street_Knight.jpg,1993,3/12/1993,A former cop returns to challenge a plot to escalate gang violence in the streets of Los Angeles.
305,Tai Chi Master,Yuen Woo Ping,"Jet Li, Michelle Yeoh",Hong Kong,//upload.wikimedia.org/wikipedia/en/thumb/e/e4/Tai_Chi_Master_DVD.jpg/220px-Tai_Chi_Master_DVD.jpg,1993,11/18/1993,"Two friends, ex Shaolin monks, part ways as they brush with the ongoing rebellion against the government. The ambitious one rises up to be a powerful military commander, while his betrayed friend resorts to learn the calm ways of Tai Chi."
306,The Black Panther Warriors,Clarence Fok,"Clarence Fok, Tony Leung Kar-Fai, Brigitte Lin",Hong Kong,//upload.wikimedia.org/wikipedia/en/thumb/7/75/BlackPantherWarriors.jpg/220px-BlackPantherWarriors.jpg,1993,11/18/1993,"Black Cougar is a mercenary who is being paid a huge sum of money by an unknown person to recover a top secret file. Realising the enormity and complexity of the task, he enlists the help of a dummy-sucking computer hacker, a sex-maniacal weapons specialist, and a charismatic 'God of Gamblers' to help him out. When he gets double-crossed by the unknown person. He sets out to seek and destroy him, with the help of his friends. He is in for a shock when he finds out what is in the file, and who the unknown person is. Written by Anonymous"
307,The Bride with White Hair,Ronny Yu,"Brigitte Lin, Leslie Cheung, Nam Kit-Ying",Hong Kong,//upload.wikimedia.org/wikipedia/en/thumb/1/1f/Bridewithwhitehair.jpg/220px-Bridewithwhitehair.jpg,1993,8/26/1993,"Cho Yat-Hang, the unwilling successor to the Wu-Tang clan throne and the unsure commander of the clan's forces in a war against an evil cult, falls in forbidden love with Lien Ni-Chang, a killer for the evil cult."
300,Hero Among Heroes,Yuen Woo Ping,"Donnie Yen, Ng Man Tat, Ying Ng",Hong Kong,//upload.wikimedia.org/wikipedia/en/thumb/6/66/Heroes_Among_Heroes_FilmPoster.jpeg/220px-Heroes_Among_Heroes_FilmPoster.jpeg,1993,11/11/1993,A kung fu master opposed to opium smoking fights its proponents and tries to stop an evil sect.
308,The Eagle Shooting Heroes,Jeffrey Lau,"Leslie Cheung, Jacky Cheung, Tony Leung Chiu-Wai",Hong Kong,//upload.wikimedia.org/wikipedia/en/thumb/7/76/The_Eagle_Shooting_Heroes.jpg/220px-The_Eagle_Shooting_Heroes.jpg,1993,2/5/1993,"A parody of Louis Cha's renowned novel The Legend of the Condor Heroes. The story begins with the Queen of Golden Wheel Kingdom and having an affair with her cousin West Poison, both of whom are planning to take over the Kingdom. The 3rd Princess discovered their treason but she was defeated by West Poison. She flees and sought for her master's help. He spoke of a powerful secret martial arts manual hidden in the mountains, which if she could retrieve and learn, she would be able to defeat West Poison. But things get complicated along the way when West Poison beat her to it and stole the secret manual away. She soon gathers an alliance to challenge West Poison's exponentially increased new power. Written by theunraveler"
309,Beverly Hills Cop III,John Landis,"Eddie Murphy, Judge Reinhold, Hector Elizondo",United States,//upload.wikimedia.org/wikipedia/en/thumb/9/9c/Beverly_Hills_Cop_III.jpg/220px-Beverly_Hills_Cop_III.jpg,1994,5/25/1994,"Axel Foley, while investigating a car theft ring, comes across something much bigger than that: the same men who killed his boss are running a counterfeit money ring out of a theme park in Los Angeles."
310,Drunken Master II,Lau Kar-Leung,"Jackie Chan, Ti Lung",Hong Kong,//upload.wikimedia.org/wikipedia/en/thumb/f/fc/DrunkenMasterII.jpg/220px-DrunkenMasterII.jpg,1994,2/3/1994,A young martial artist is caught between respecting his pacifist father's wishes or stopping a group of disrespectful foreigners from stealing precious artifacts. EN
311,God of Gamblers' Return,Wong Jing,"Chow Yun-Fat, Charles Heung, Tony Leung Kar-Fai",Hong Kong,//upload.wikimedia.org/wikipedia/en/thumb/2/23/GodofGamblersReturn.jpg/220px-GodofGamblersReturn.jpg,1994,12/15/1994,"Ko Chun, the God of Gamblers, returns living a wealthy life, but a rival appears, killing the God of Gamblers pregnant wife and soon to be son. Before dying, his wife tells him not to gamble for one year and not to reveal his identity as the God of Gamblers. A year almost passes, and the gambler lives a forgiving life, until the man who kills his wife appears, taking revenge into his own hands..... Written by Victor Nguyen <nguyens@flash.net>"
312,Hellbound,Aaron Norris,"Chuck Norris, Calvin Levels, Christopher Neame",United States,//upload.wikimedia.org/wikipedia/en/thumb/d/d0/Hellboundposter.jpg/220px-Hellboundposter.jpg,1994,1/21/1994,"Shatter and Jackson, two Chicago police officers, are investigating the brutal murder of a rabbi and are summoned to Israel for questioning. While they are in Israel they continue their investigation there on some leads they have. After a while they begin to understand that they are trying to catch a supernatural being, and if they don't do it fast something terrible will happen. Written by Lars J. Aas <larsa@colargol.edb.tih.no>"
313,No Escape,Martin Campbell,"Ray Liotta, Lance Henriksen, Stuart Wilson",United States,//upload.wikimedia.org/wikipedia/en/thumb/2/22/No_escape_poster.jpg/220px-No_escape_poster.jpg,1994,4/21/1994,"A social media personality travels with his friends to Moscow to capture new content for his successful VLOG. Always pushing the limits and catering to a growing audience, they enter a cold world of mystery, excess, and danger."
314,Surviving the Game,Ernest R. Dickerson,"Ice-T, Rutger Hauer, Charles S. Dutton",United States,//upload.wikimedia.org/wikipedia/en/thumb/e/ec/Surviving_the_Game_DVD_cover.jpg/220px-Surviving_the_Game_DVD_cover.jpg,1994,4/15/1994,"A homeless man is hired as a survival guide for a group of wealthy businessmen on a hunting trip in the mountains, unaware that they are killers who hunt humans for sport, and that he is their new prey."
315,The Bodyguard from Beijing,Corey Yuen,"Jet Li, Christy Chung, Kent Cheng",Hong Kong,//upload.wikimedia.org/wikipedia/en/thumb/c/c8/The-Bodyguard-from-Beijing.jpg/220px-The-Bodyguard-from-Beijing.jpg,1994,7/28/1994,"A corrupt businessman commits a murder and the only witness is the girlfriend of another businessman with close connections to the Chinese government, so a bodyguard from Beijing is dispatched to help two Hong Kong cops protect the witness. Complications arise when the bodyguard and the witness must confront their deep feelings for one another."
316,The Chase,Adam Rifkin,"Charlie Sheen, Kristy Swanson, Henry Rollins",United States,//upload.wikimedia.org/wikipedia/en/thumb/c/c8/Thechaseposter.jpg/220px-Thechaseposter.jpg,1994,3/4/1994,The escape of Bubber Reeves from prison affects the inhabitants of a small Southern town. EN
317,Wing Chun,Yuen Woo Ping,"Michelle Yeoh, Donnie Yen, Cheng Pei-pei",Hong Kong,https://cps-static.rovicorp.com/2/Open/France/AB1-RTL-NT1/Wing%20chun/_derived_jpg_q90_584x800_m0/Wing-Chun-German-Poster.jpg,1994,3/24/1994,"Wing Chun, a woman living in a remote village often pillaged by robbers. When Wing Chun finally loses her cool and defeats them, her heroic actions stir up even more trouble in this male-based society of the time. The climactic battle to the death is a dazzler. Written by Towne 3, San Jose, Ca"
318,Best of the Best 3,Phillip Rhee,"Phillip Rhee, Christopher McDonald, Gina Gershon",United States,//upload.wikimedia.org/wikipedia/en/thumb/a/af/Best_of_the_Best_3.jpg/220px-Best_of_the_Best_3.jpg,1995,5/17/1995,"While visiting his sister, Tommy Lee discovers a band of ruthless white supremacists is planning to shatter the peace of a small rural community. But what these thugs don't realize is that with Tommy, they're in for the fight of their lives. With the help of an honorable sheriff and a headstrong young teacher, Tommy battles back against the hateful group, waging war with everything he has to protect the town. Now, there's no turning back."
319,Congo,Frank Marshall,"Dylan Walsh, Laura Linney, Ernie Hudson",United States,//upload.wikimedia.org/wikipedia/en/thumb/3/3f/Congo_movie_poster.jpg/220px-Congo_movie_poster.jpg,1995,6/9/1995,"When an expedition to the African Congo ends in disaster, a new team is assembled to find out what went wrong. EN"
320,Die Hard with a Vengeance,John McTiernan,"Bruce Willis, Jeremy Irons, Samuel L. Jackson",United States,//upload.wikimedia.org/wikipedia/en/thumb/4/4c/Die_Hard_With_A_Vengance.jpg/220px-Die_Hard_With_A_Vengance.jpg,1995,5/19/1995,"John McClane and a Harlem store owner are targeted by German terrorist Simon Gruber in New York City, where he plans to rob the Federal Reserve Building. EN"
321,Outbreak,Wolfgang Petersen,"Dustin Hoffman, Rene Russo, Morgan Freeman",United States,//upload.wikimedia.org/wikipedia/en/thumb/0/08/Outbreak_movie.JPG/220px-Outbreak_movie.JPG,1995,3/10/1995,Army doctors struggle to find a cure for a deadly virus spreading throughout a California town that was brought to America by an African monkey. EN
322,Rumble in the Bronx,Stanley Tong,"Jackie Chan, Anita Mui, Bill Tung",Hong Kong,//upload.wikimedia.org/wikipedia/en/thumb/6/6e/Rumble-in-the-Bronx-poster.jpg/220px-Rumble-in-the-Bronx-poster.jpg,1995,1/21/1995,A young man visiting and helping his uncle in New York City finds himself forced to fight a street gang and the mob with his martial art skills. EN
360,Blue Streak,Les Mayfield,"Martin Lawrence, Luke Wilson, Peter Greene",United States,//upload.wikimedia.org/wikipedia/en/thumb/a/ab/Blue_Streak_film_poster.jpg/220px-Blue_Streak_film_poster.jpg,1999,9/17/1999,A former convict poses as a cop to retrieve a diamond he stole years ago.
323,Soldier Boyz,Louis Mourneau,"Michael Dudikoff, Cary-Hiroyuki Tagawa, Tyrin Turner",United States,//upload.wikimedia.org/wikipedia/en/thumb/e/e1/Poster_of_the_movie_Soldier_Boyz.jpg/220px-Poster_of_the_movie_Soldier_Boyz.jpg,1995,10/18/1995,A group of prisoners are going to Vietnam to rescue the daughter of a V-I.P. The Ones who survive get their freedom back...but hell awaits them.
324,Tank Girl,Rachel Talalay,"Lori Petty, Malcolm McDowell, Ice-T",United States,//upload.wikimedia.org/wikipedia/en/thumb/1/12/Tank_girl_poster.jpg/220px-Tank_girl_poster.jpg,1995,3/31/1995,"A girl is among the few survivors of a dystopian Earth. Riding a war tank, she fights against the tyranny of a mega-corporation that dominates the remaining potable water supply of the planet."
326,Top Dog,Aaron Norris,"Chuck Norris, Clyde Kusatsu, Michele Lamar Richards",United States,//upload.wikimedia.org/wikipedia/en/thumb/5/5b/Topdogposter.jpg/220px-Topdogposter.jpg,1995,4/28/1995,"With his cop companion shot and killed by terrorists, Reno The Dog pairs up with tough cop Jake in thwarting the criminal organization."
327,Beyond Hypothermia,Patrick Leung,"Lau Ching-Wan, Wu Chien-lien, Han Sang-woo",Hong Kong,//upload.wikimedia.org/wikipedia/en/c/c0/Beyond_Hypothermia_%28film%29.png,1996,10/18/1996,"A mysterious and highly skilled hitwoman in Hong Kong is paid to assassinate top-level crime bosses. After striking up a relationship with a noodle vendor, she decides to travel to South Korea to complete one last job. Unfortunately, the dead man's bodyguard is out for revenge. Written by Trey Evans"
328,Black Mask,Daniel Lee,Jet Li,Hong Kong,//upload.wikimedia.org/wikipedia/en/thumb/3/33/BlackMaskPoster.jpg/220px-BlackMaskPoster.jpg,1996,11/9/1996,A survivor of a supersoldier project must fight his former comrades as a masked hero. EN
329,Bulletproof,Ernest R. Dickerson,"Damon Wayans, Adam Sandler",United States,//upload.wikimedia.org/wikipedia/en/thumb/2/24/Bulletprooftp.jpg/220px-Bulletprooftp.jpg,1996,9/6/1996,"Two criminals, Keats and Moses, end their friendship, when Keats turns out to be an undercover cop. Many years later, the two are forced to work together when Keats is assigned to protect Moses as a witness."
330,"Dr. Wai in ""The Scripture with No Words""",Ching Siu Tung,"Takeshi Kaneshiro, Charlie Yeung, Jet Li",Hong Kong,//upload.wikimedia.org/wikipedia/en/thumb/c/cb/DrWaiinTheScripturewithNoWords.jpg/220px-DrWaiinTheScripturewithNoWords.jpg,1996,3/14/1996,"A serial adventure writer with problems in his personal life lives out the adventures of his literary hero, King of Adventurers."
331,Eraser,Chuck Russell,"Arnold Schwarzenegger, James Caan, Vanessa L. Williams",United States,//upload.wikimedia.org/wikipedia/en/thumb/2/2c/Eraser_%28movie_poster%29.jpg/220px-Eraser_%28movie_poster%29.jpg,1996,6/21/1996,A Witness Protection specialist becomes suspicious of his co-workers when dealing with a case involving high-tech weapons.
332,Executive Decision,Stuart Baird,"Kurt Russell, Halle Berry, John Leguizamo",United States,//upload.wikimedia.org/wikipedia/en/thumb/2/2d/Executive_decision_ver1.jpg/220px-Executive_decision_ver1.jpg,1996,3/15/1996,"When terrorists seize control of an airliner, an intelligence analyst accompanies a commando unit for a midair boarding operation. EN"
333,Mission: Impossible,Brian De Palma,"Tom Cruise, Jon Voight, Emmanuelle B�art",United States,//upload.wikimedia.org/wikipedia/en/thumb/e/e1/MissionImpossiblePoster.jpg/220px-MissionImpossiblePoster.jpg,1996,5/22/1996,"An American agent, under false suspicion of disloyalty, must discover and expose the real spy without the help of his organization."
334,Sci-Fighters,Peter Svatek,"Roddy Piper, Jayne Heitmeyer, Billy Drago",United States,https://image.tmdb.org/t/p/original/iLBdI33lclgjOa7QMXosi6bCu9H.jpg,1996,12/30/1996,"Boston, 2009. A police detective (Roddy Piper) searches for Adrian Dunn, his ex-partner (Billy Drago) who murdered his wife. Dunn has escaped from prison on the moon and returned to Earth with an alien virus. Written by Peter Svatek <svatek@aei.ca>"
335,The Crow: City of Angels,Tim Pope,"Vincent Perez, Mia Kirshner, Richard Brooks",United States,//upload.wikimedia.org/wikipedia/en/thumb/1/15/The_Crow_2.jpg/220px-The_Crow_2.jpg,1996,8/30/1996,The spirit of the Crow resurrects another man seeking revenge for the murder of his son.
336,The Substitute,Robert Mandel,"Tom Berenger, Ernie Hudson, Diane Venora",United States,//upload.wikimedia.org/wikipedia/en/thumb/a/af/Substituteposter.jpg/220px-Substituteposter.jpg,1996,4/19/1996,Mercenary Shale's team is retired after a (not so) covert mission in Cuba. He becomes substitute teacher at his teacher fiancee's Miami high school to get those behind kneecapping her. His team helps him. EN
337,Twister,Jan de Bont,"Helen Hunt, Bill Paxton, Cary Elwes",United States,//upload.wikimedia.org/wikipedia/en/thumb/a/a5/Twistermovieposter.jpg/220px-Twistermovieposter.jpg,1996,5/10/1996,"Bill and Jo Harding, advanced storm chasers on the brink of divorce, must join together to create an advanced weather alert system by putting themselves in the cross-hairs of extremely violent tornadoes."
338,Young and Dangerous,Andrew Lau,"Chan Sau-yu, Jordan Chan",Hong Kong,//upload.wikimedia.org/wikipedia/en/thumb/f/fa/Young_and_Dangerous.jpg/220px-Young_and_Dangerous.jpg,1996,1/26/1996,"Nam opens a bar in Wanchai and continues his rise in Hong Kong's Hung Hing gang. His best friend, Chicken, needs to lie low, so he's sent to Taiwan to work for Lui, leader of the San Luen gang; there, he falls for the aging Lui's mistress, Ting Yiu. When Chicken returns to Hong Kong, he finds Nam in a struggle with long time rival, Fai Fat. Then, Lui shows up, demanding that Hung Hing sell him a half interest in their new Macau casino. When Chiang, the Hung Hing boss, wants to think about it, Lui threatens war, Chicken must choose sides, and Ting Yui sets up a meeting. Chicken's affections, Fai and Nam's rivalry, Lui's greed, and Ting's intentions are on a collision course. Written by <jhailey@hotmail.com>"
339,Young and Dangerous 2,Andrew Lau,"Jordan Chan, Cheng Yee-kin, Yau Chingmy",Hong Kong,//upload.wikimedia.org/wikipedia/en/thumb/2/20/Young_and_Dangerous_2.jpg/220px-Young_and_Dangerous_2.jpg,1996,3/30/1996,The story is told in two parts: the first focuses on Chicken and his exile in Taiwan skipped over in the first film. The second half deals with the Hung Hing Society trying to ally with Chicken's Taiwanese triad.
340,Batman & Robin,Joel Schumacher,"Arnold Schwarzenegger, George Clooney, Chris O'Donnell",United States,//upload.wikimedia.org/wikipedia/en/3/37/Batman_%26_Robin_poster.jpg,1997,6/12/1997,Batman and Robin try to keep their relationship together even as they must stop Mr. Freeze and Poison Ivy from freezing Gotham City.
341,Double Team,Tsui Hark,"Jean-Claude Van Damme, Dennis Rodman, Mickey Rourke",United States,//upload.wikimedia.org/wikipedia/en/thumb/d/d6/Double_team_ver1.jpg/220px-Double_team_ver1.jpg,1997,4/4/1997,An international spy teams up with an arms dealer to escape from a penal colony and rescue his family from a terrorist.
342,Face/Off,John Woo,"Nicolas Cage, John Travolta, Joan Allen",United States,//upload.wikimedia.org/wikipedia/en/thumb/0/0c/FaceOff_%281997_film%29_poster.jpg/220px-FaceOff_%281997_film%29_poster.jpg,1997,6/27/1997,"In order to foil a terrorist plot, an FBI agent undergoes facial transplant surgery and assumes the identity of a criminal mastermind, who murdered his only son. The plan turns sour when the criminal wakes up prematurely and seeks revenge."
