movie_id,movie,director,stars,country,url,release_year,released,plot
41,Bodyguard Kiba,Takashi Miike,"Hisao Maki, Masaru Matsuda, Takeshi Yamato",Japan,//upload.wikimedia.org/wikipedia/en/thumb/b/bb/BodyGuardKiba1993FilmPALDVDCover.jpg/220px-BodyGuardKiba1993FilmPALDVDCover.jpg,1993,6/25/1993,"A ex-prisoner hires the invincible bodyguard Kiba to protect him from vengeful Yakuza, while he travels cross-country to the location of some hidden loot."
44,Cliffhanger,Renny Harlin,"Sylvester Stallone, John Lithgow, Michael Rooker",United States,//upload.wikimedia.org/wikipedia/en/thumb/4/4a/Cliffhanger_Poster.jpg/220px-Cliffhanger_Poster.jpg,1993,5/28/1993,A botched mid-air heist results in suitcases full of cash being searched for by various groups throughout the Rocky Mountains.
45,Crime Story,Kirk Wong,"Jackie Chan, Kent Chang, Law Kar-ying",Hong Kong,//upload.wikimedia.org/wikipedia/en/thumb/9/9e/Crime-Story-Poster.jpg/220px-Crime-Story-Poster.jpg,1993,6/24/1993,The saga of a Chicago police detective's efforts to stop a young hood's ruthless rise in the ranks of organized crime.
47,Extreme Justice,Mark L. Lester,"Scott Glenn, Lou Diamond Phillips, Chelsea Field",United States,//upload.wikimedia.org/wikipedia/en/thumb/6/69/Extreme_justice.jpg/220px-Extreme_justice.jpg,1993,1993,"A rogue cop joins an elite L.A.P.D. unit who secretly operate as a vigilante death squad, but soon begins to question their methods."
48,Iron Monkey,Yuen Woo Ping,"Yu Rongguang, Donnie Yen, Jean Wang",Hong Kong,//upload.wikimedia.org/wikipedia/en/thumb/b/b0/Iron-MonkeyPoster.jpg/220px-Iron-MonkeyPoster.jpg,1993,9/3/1993,A martial artist/doctor steals from the corrupt authorities as a masked thief to give to the poor while another martial artist/doctor is forced to hunt him down. But a major threat unites them as a powerful and traitorous shaolin monk takes over the authorities.
38,American Cyborg: Steel Warrior,Boaz Davidson,"Joe Lara, Nicole Hansen, John Saint Ryan",United States,//upload.wikimedia.org/wikipedia/en/d/d2/American_Cyborg.jpg,1994,1/7/1994,One of Earth's last fertile women flees a devastated lab with an incubating foetus in tow and a killer cyborg in pursuit.
46,Excessive Force,Jon Hess,"Thomas Ian Griffith, Lance Henriksen, James Earl Jones, Tony Todd",United States,//upload.wikimedia.org/wikipedia/en/thumb/f/fc/Excessive_Force_%281993%29_Film_Poster.jpg/220px-Excessive_Force_%281993%29_Film_Poster.jpg,1993,5/14/1993,"Chicago policeman Terry McCain (Thomas Ian Griffith) is determined to put away mobster Sal DiMarco (Burt Young), who always gets acquitted on technicalities. While monitoring a drug sale, a shootout ensues, and one of Terry's fellow officers gets away with $3 million of Sal's money. Suspecting Terry took the cash, the mobster sends his men to kill Terry's brother, Dylan (Tom Hodges), and partner, Frankie Hawkins (Tony Todd). Furious, Terry sets out to take his revenge by any means necessary."
50,Martial Outlaw,Kurt Anderson,"Jeff Wincott, Gary Hudson, Richard Jaeckel",United States,//upload.wikimedia.org/wikipedia/en/thumb/9/93/Martial_Outlaw_FilmPoster.jpeg/220px-Martial_Outlaw_FilmPoster.jpeg,1993,1993,"A DEA agent and his brother, a Los Angeles cop, battle the Russian mafia."
51,Nowhere to Run,Robert Harmon,"Jean-Claude Van Damme, Rosanna Arquette, Joss Ackland",United States,//upload.wikimedia.org/wikipedia/en/thumb/1/18/Nowhere_to_Run.jpg/220px-Nowhere_to_Run.jpg,1993,1/15/1993,"Sam, an escaped convict, lands up on a farmland owned by a widow. When he learns that a ruthless contractor is trying to take over her land, he helps her to fight against the injustice."
52,Once a Cop,Stanley Tong,"Michelle Yeoh, Yu Rongguang",Hong Kong,//upload.wikimedia.org/wikipedia/en/thumb/4/4f/Supercop_2_Project_S.png/220px-Supercop_2_Project_S.png,1993,10/21/1993,"As a crime wave sweeps through Hong Kong, the police call on Jessica Yang, a rising star in their ranks, to help stop a notorious gang of thieves."
53,Once Upon a Time in China III,Tsui Hark,"Rosamund Kwan, Lau Shun, Jet Li",Hong Kong,//upload.wikimedia.org/wikipedia/en/thumb/e/e9/OnceUponATime3.jpg/220px-OnceUponATime3.jpg,1993,2/11/1993,"Master Wong and his disciples enroll in the 'Dancing Lion Competition' to stop an assassination plot and to battle an arrogant, deceitful opponent."
54,Once Upon a Time in China IV,Yuen Bun,Zhao Wenzhuo,Hong Kong,//upload.wikimedia.org/wikipedia/en/thumb/9/9a/OUATIC4_DVDcover.jpg/220px-OUATIC4_DVDcover.jpg,1993,6/10/1993,Wong Fei Hung must deal with both foreign threats and the nationalist Red Lantern Society in this continuation of the popular kung fu series.
58,The Avenging Quartet,Stanley Wing Siu,"Cynthia Khan, Moon Lee, Yukari Oshima, Michiko Nishiwaki",Hong Kong,http://lnx.asianfeast.org/wp-content/uploads/2011/05/TheAvengingQuartet_00.jpg,1993,1993,A female Chinese cop teams up with a lady kung-fu master to stop two female Japanese gangsters from stealing a valuable painting.
59,The Fugitive,Andrew Davis,"Harrison Ford, Tommy Lee Jones",United States,//upload.wikimedia.org/wikipedia/en/thumb/c/c7/The_Fugitive_movie.jpg/220px-The_Fugitive_movie.jpg,1993,8/6/1993,"With the city in a state of panic and misinformation traveling at the speed of social media, Mike's life and family hang in the balance as he becomes - The Fugitive."
60,The Meteor Man,Robert Townsend,"Robert Townsend, Marla Gibbs, Eddie Griffin",United States,//upload.wikimedia.org/wikipedia/en/thumb/d/dc/Meteor_man.jpg/220px-Meteor_man.jpg,1993,8/6/1993,A high school teacher from a troubled inner city Washington D.C. neighborhood becomes a super-powered hero and takes on the gang that has been terrorizing his streets.
61,Undercover Blues,Herbert Ross,"Kathleen Turner, Dennis Quaid, Fiona Shaw",United States,//upload.wikimedia.org/wikipedia/en/thumb/1/1f/Undercover_blues.jpg/220px-Undercover_blues.jpg,1993,9/10/1993,"A spy couple on maternity leave in New Orleans, entertained by a mugger named Muerte, is called in when Novacek steals explosives."
62,Undefeatable,Godfrey Hall,"Cynthia Rothrock, Don Niam, John Miller",Hong Kong,//upload.wikimedia.org/wikipedia/en/thumb/4/4b/Undefeatablebox.jpg/220px-Undefeatablebox.jpg,1993,9/29/1993,Kristi Jones (Cynthia Rothrock) avenges her sister's death at the hands of a crazed martial arts rapist.
63,A Low Down Dirty Shame,Keenen Ivory Wayans,"Keenen Ivory Wayans, Charles S. Dutton, Jada Pinkett Smith",United States,//upload.wikimedia.org/wikipedia/en/thumb/d/d6/Low_down_dirty_shame.jpg/220px-Low_down_dirty_shame.jpg,1994,11/23/1994,"An ex-cop, now a private detective, takes on the search for the millions stolen by a drug lord."
64,Ashes of Time,Wong Kar-wai,"Brigitte Lin, Leslie Cheung, Maggie Cheung",Hong Kong,//upload.wikimedia.org/wikipedia/en/3/37/Ashes2.jpg,1994,9/17/1994,A broken-hearted hit man moves to the desert where he finds skilled swordsmen to carry out his contract killings.
65,Blankman,Mike Binder,"Damon Wayans, David Alan Grier",United States,//upload.wikimedia.org/wikipedia/en/thumb/a/a1/Blankman.jpg/220px-Blankman.jpg,1994,8/19/1994,A simpleton inventor becomes a superhero with a bulletproof costume and a low budget.
67,Clear and Present Danger,Phillip Noyce,"Harrison Ford, Willem Dafoe, Anne Archer",United States,//upload.wikimedia.org/wikipedia/en/thumb/3/36/Clear_and_Present_Danger_film.jpg/220px-Clear_and_Present_Danger_film.jpg,1994,8/3/1994,CIA Analyst Jack Ryan is drawn into an illegal war fought by the US government against a Colombian drug cartel.
68,Death Wish V: The Face of Death,Allan A. Goldstein,"Charles Bronson, Lesley-Anne Down, Michael Parks",United States,//upload.wikimedia.org/wikipedia/en/thumb/e/e5/DeathWish5.jpg/220px-DeathWish5.jpg,1994,1/14/1994,"Paul Kersey is back at working vigilante justice when his fianc�e, Olivia, has her business threatened by mobsters."
69,Double Dragon,James Yukich,"Robert Patrick, Mark Dacascos, Scott Wolf",United States,//upload.wikimedia.org/wikipedia/en/thumb/4/43/Double_Dragon_1994_movie_poster.jpg/220px-Double_Dragon_1994_movie_poster.jpg,1994,11/4/1994,"Two brothers have half of a powerful ancient Chinese talisman. An evil gang leader has the other half, and determines to get the brothers' half and have a complete medallion so he can gain absolute power."
70,Drop Zone,John Badham,"Wesley Snipes, Gary Busey, Yancy Butler",United States,//upload.wikimedia.org/wikipedia/en/thumb/5/56/Drop_zone_ver2.jpg/220px-Drop_zone_ver2.jpg,1994,12/9/1994,A tough cop teams up with a professional skydiver to capture a renegade computer hacker on the run from the law.
71,Fist of Legend,Gordon Chan,"Jet Li, Paul Chiang, Chin Siu Ho",Hong Kong,//upload.wikimedia.org/wikipedia/en/thumb/8/80/FistOfLegend.Jpg/220px-FistOfLegend.Jpg,1994,12/22/1994,"In 1937, a Chinese martial artist returns to Shanghai to find his teacher dead and his school harassed by the Japanese."
57,TC 2000,T. J. Scott,"Billy Blanks, Jalal Merhi, Bolo Yeung, Matthias Hues",CanadaUnited States,https://loftcinema.org/files/2015/01/tc-2000-movie-poster-1993-1020230639.jpg,1993,1993,"A futuristic cop and his lethal comrade battle ruthless gangs, corruption and a nearly indestructible killing machine."
66,Burning Paradise,Ringo Lam,"Willie Chi, Lin Quan, Yang Sheng",Hong Kong,https://en.hkcinema.ru/foto/2390dfad.jpg,1994,3/26/1994,Shaolin monks use their deadly kung-fu skills against evil minions of China's Manchu Dynasty.
72,Gunmen,Deran Sarafian,"Christopher Lambert, Mario Van Peebles, Denis Leary",United States,//upload.wikimedia.org/wikipedia/en/thumb/d/db/Gunmen-poster.jpg/220px-Gunmen-poster.jpg,1994,2/4/1994,"USD400,000,000 is stolen and a drug lord wants it back. The killed thief's brother is broken out of prison by a DEA bounty hunter to help find the money boat. The body count continues in Latin America."
73,Love on Delivery,"Stephen Chow, Lee Lik-chee",NULL,Hong Kong,//upload.wikimedia.org/wikipedia/en/thumb/0/02/Love-On-Delivery-poster.jpg/220px-Love-On-Delivery-poster.jpg,1994,1994,"To prove himself to a love interest, a delivery boy learns dubious kung fu from an aging charlatan so he can challenge his archrival to a fight."
74,Men of War,Perry Lang,"Dolph Lundgren, Charlotte Lewis, B.D. Wong",United States,//upload.wikimedia.org/wikipedia/en/thumb/c/c2/Men-of-War-poster.jpg/220px-Men-of-War-poster.jpg,1994,9/3/1994,A former Special Ops soldier leads a group of mercenaries to an island in the South China Sea: their mission is obtain the rights to the unusual treasure that the island beholds.
75,Street Fighter,Steven E. de Souza,"Jean-Claude Van Damme, Ra�l Juli�, Ming-Na Wen",United States,//upload.wikimedia.org/wikipedia/en/thumb/9/97/StreetFighterMoviePoster.jpg/215px-StreetFighterMoviePoster.jpg,1994,12/23/1994,Col. Guile and various other martial arts heroes fight against the tyranny of Dictator M. Bison and his cohorts.
76,The Cowboy Way,Gregg Champion,"Woody Harrelson, Kiefer Sutherland, Dylan McDermott",United States,//upload.wikimedia.org/wikipedia/en/thumb/c/c1/Cowboy_way_ver2.jpg/220px-Cowboy_way_ver2.jpg,1994,6/3/1994,"As they visit New York City, a pair of cowboys have to become unlikely heroes when their friend is kidnapped."
77,The Getaway,Roger Donaldson,"Alec Baldwin, Kim Basinger, Michael Madsen",United States,//upload.wikimedia.org/wikipedia/en/thumb/0/0b/Getawayposter1994.jpg/220px-Getawayposter1994.jpg,1994,2/11/1994,An ex-con and his devoted wife must flee from danger when a heist doesn't go as planned.
78,The New Legend Of Shaolin,"Corey Yuen, Wong Jing","Jet Li, Chuen-Hua Chi, Chen Sung-Yung",Hong Kong,//upload.wikimedia.org/wikipedia/en/thumb/6/6b/New-Legend-of-Shaolin-poster.jpg/220px-New-Legend-of-Shaolin-poster.jpg,1994,3/3/1994,"It takes a father and son team to battle the forces of evil throughout China, fighting with honor to defend the weak through fast-motion kung fu."
79,True Lies,James Cameron,"Arnold Schwarzenegger, Jamie Lee Curtis, Tom Arnold",United States,//upload.wikimedia.org/wikipedia/en/thumb/8/81/True_Lies_poster.png/220px-True_Lies_poster.png,1994,7/15/1994,"A fearless, globe-trotting, terrorist-battling secret agent has his life turned upside down when he discovers his wife might be having an affair with a used-car salesman while terrorists smuggle nuclear war heads into the United States."
80,Assassins,Richard Donner,"Sylvester Stallone, Antonio Banderas, Julianne Moore",United States,//upload.wikimedia.org/wikipedia/en/thumb/f/f5/Assassins_ver1.jpg/220px-Assassins_ver1.jpg,1995,10/6/1995,Professional hit-man Robert Rath wants to fulfill a few more contracts before retiring but unscrupulous ambitious newcomer hit-man Miguel Bain keeps killing Rath's targets.
81,Batman Forever,Joel Schumacher,"Val Kilmer, Tommy Lee Jones, Jim Carrey",United States,//upload.wikimedia.org/wikipedia/en/thumb/9/9d/Batman_Forever_poster.png/220px-Batman_Forever_poster.png,1995,6/9/1995,"Batman must battle former district attorney Harvey Dent, who is now Two-Face and Edward Nygma, The Riddler with help from an amorous psychologist and a young circus acrobat who becomes his sidekick, Robin."
82,Crimson Tide,Tony Scott,"Denzel Washington, Gene Hackman, George Dzundza",United States,//upload.wikimedia.org/wikipedia/en/thumb/f/ff/Crimson_tide_movie_poster.jpg/220px-Crimson_tide_movie_poster.jpg,1995,5/12/1995,"On a U.S. nuclear missile sub, a young First Officer stages a mutiny to prevent his trigger happy Captain from launching his missiles before confirming his orders to do so."
83,Crying Freeman,Christophe Gans,"Mark Dacascos, Julie Condra, Tch�ky Karyo",FranceCanada,//upload.wikimedia.org/wikipedia/en/thumb/0/02/Cryingfreemanmovie.jpg/220px-Cryingfreemanmovie.jpg,1995,9/14/1995,A woman sees an assassin outside San Francisco killing yakuza men and later in Vancouver. She's been told that he leaves no witness. Will she be his next victim or...?
84,Desperado,Robert Rodriguez,"Antonio Banderas, Salma Hayek, Joaquim de Almeida",United States,//upload.wikimedia.org/wikipedia/en/a/a6/Desperado1.jpg,1995,8/25/1995,Former musician and gunslinger El Mariachi arrives at a small Mexican border town after being away for a long time. His past quickly catches up with him and he soon gets entangled with the local drug kingpin Bucho and his gang.
86,Fair Game,Andrew Sipes,"William Baldwin, Cindy Crawford, Steven Berkoff",United States,//upload.wikimedia.org/wikipedia/en/thumb/c/c9/Fair_game.jpg/220px-Fair_game.jpg,1995,11/3/1995,CIA operative Valerie Plame discovers her identity is allegedly leaked by the government as payback for an op-ed article her husband wrote criticizing the Bush administration.
88,GoldenEye,Martin Campbell,"Pierce Brosnan, Sean Bean, Izabella Scorupco",United States,//upload.wikimedia.org/wikipedia/en/thumb/2/24/GoldenEye_-_UK_cinema_poster.jpg/220px-GoldenEye_-_UK_cinema_poster.jpg,1995,11/13/1995,"Years after a friend and fellow 00 agent is killed on a joint mission, a secret space based weapons program known as ""GoldenEye"" is stolen. James Bond sets out to stop a Russian crime syndicate from using the weapon."
89,Heat,Michael Mann,"Al Pacino, Robert De Niro, Val Kilmer",United States,//upload.wikimedia.org/wikipedia/en/6/6c/Heatposter.jpg,1995,12/15/1995,A group of professional bank robbers start to feel the heat from police when they unknowingly leave a clue at their latest heist.
87,Fist of the North Star,Tony Randel,"Gary Daniels, Chris Penn, Malcolm McDowell",United States,//upload.wikimedia.org/wikipedia/en/thumb/d/da/Fist_of_the_North_Star_%28live-action_movie_poster%29.jpg/220px-Fist_of_the_North_Star_%28live-action_movie_poster%29.jpg,1995,1995,The heir to a special set of martial-arts secrets battles dictators in a post-apocalyptic future.
90,High Risk,"Corey Yuen, Wong Jing","Jet Li, Jacky Cheung, Yau Chingmy",Hong Kong,//upload.wikimedia.org/wikipedia/en/thumb/a/aa/High-Risk-Poster.jpg/220px-High-Risk-Poster.jpg,1995,7/13/1995,"Kit leaves the police force after the death of his family at the hands of a terrorist named `The Doctor'. Kit becomes the bodyguard for Frankie, a movie star who is famous for supposedly doing his own daring stuntwork. Frankie, a shameless send-up of action superstar Jackie Chan, turns out to be a drunken womaniser whose martial arts skills have waned - Kit secretly performs all of the actor's stunts."
91,Johnny Mnemonic,Robert Longo,"Keanu Reeves, Dolph Lundgren, Beat Takeshi Kitano",Canada,//upload.wikimedia.org/wikipedia/en/thumb/7/7b/Johnny_mnemonic_ver1.jpg/220px-Johnny_mnemonic_ver1.jpg,1995,5/26/1995,"A data courier, literally carrying a data package inside his head, must deliver it before he dies from the burden or is killed by the Yakuza."
92,Kamikaze Taxi,Masato Harada,"Takeshi Caesar, Chika Nakagami, Mickey Curtis",Japan,"https://m.media-amazon.com/images/M/MV5BMTIzMzU5Njg1Ml5BMl5BanBnXkFtZTcwNDg2MjcyMQ@@._V1_UY268_CR3,0,182,268_AL_.jpg",1995,4/25/1995,A revenge-seeking man and his foolish friends plan to rob a yakuza gang.
93,Midnight Man,John Weidner,"Lorenzo Lamas, James Lew, Mako",United States,//upload.wikimedia.org/wikipedia/en/thumb/6/67/Midnight_Man_FilmPoster.jpeg/220px-Midnight_Man_FilmPoster.jpeg,1995,4/28/1995,"When the police start a crackdown on Yakuza activities, a killer (James Lew) starts killing the cops forcing a martial-arts officer (Lorenzo Lamas) to fight back."
95,Screamers,Christian Duguay,"Ron White, Peter Weller, Jennifer Rubin",United StatesCanadaJapan,//upload.wikimedia.org/wikipedia/en/thumb/e/eb/Screamersposter.jpg/215px-Screamersposter.jpg,1995,9/8/1995,"A military commander stationed off planet during an interplanetary war travels through the devastated landscape to negotiate a peace treaty, but discovers that the primitive robots they built to kill enemy combatants have gained sentience."
96,Sudden Death,Peter Hyams,"Jean-Claude Van Damme, Powers Boothe, Raymond J. Barry",United States,//upload.wikimedia.org/wikipedia/en/thumb/5/5d/Sudden_Death_%281995_film_poster%29.jpg/220px-Sudden_Death_%281995_film_poster%29.jpg,1995,12/22/1995,A former fireman takes on a group of terrorists holding the Vice President and others hostage during the seventh game of the NHL Stanley Cup finals.
97,Thunderbolt,Gordon Chan,"Jackie Chan, Anita Yuen, Chor Yuen",Hong Kong,//upload.wikimedia.org/wikipedia/en/5/51/JCThunderbolt_poster.jpg,1995,9/1/1995,"In order to release his kidnapped sister, sports car mechanic Chan Foh To (Jackie Chan) has to beat a supercriminal street racer."
98,Waterworld,Kevin Reynolds,"Kevin Costner, Dennis Hopper, Jeanne Tripplehorn",United States,//upload.wikimedia.org/wikipedia/en/thumb/5/5f/Waterworld.jpg/215px-Waterworld.jpg,1995,7/28/1995,"In a future where the polar ice-caps have melted and Earth is almost entirely submerged, a mutated mariner fights starvation and outlaw ""smokers,"" and reluctantly helps a woman and a young girl try to find dry land."
99,Barb Wire,David Hogan,"Pamela Anderson, Temuera Morrison, Victoria Rowell",United States,//upload.wikimedia.org/wikipedia/en/thumb/6/61/Barbwireposter.jpg/220px-Barbwireposter.jpg,1996,5/3/1996,"During the Second American Civil War in 2017, Barb Wire owns a nightclub called the Hammerhead. Things become complicated when her ex-lover Axel Hood, who is married to the fugitive Corrina Devonshire, re-enters her life."
100,Big Bullet,Benny Chan,"Lau Ching-Wan, Francis Ng",Hong Kong,//upload.wikimedia.org/wikipedia/en/thumb/8/82/Big-bullet-poster.jpg/220px-Big-bullet-poster.jpg,1996,7/26/1996,"After assaulting his tactical commander during a raid gone sour, a dedicated but temperamental cop Sergeant Bill Chu is demoted to the Emergency Unit, long considered to be the police force's dumping ground for problem cops."
101,Chain Reaction,Andrew Davis,"Keanu Reeves, Morgan Freeman, Rachel Weisz",United States,//upload.wikimedia.org/wikipedia/en/thumb/1/1e/Chain_reaction_ver1.jpg/220px-Chain_reaction_ver1.jpg,1996,8/2/1996,Two researchers in a green alternative energy project are put on the run when they are framed for murder and treason.
102,Daylight,Rob Cohen,"Sylvester Stallone, Amy Brenneman, Viggo Mortensen",United States,//upload.wikimedia.org/wikipedia/en/thumb/a/a6/Daylight_Stallone.jpg/220px-Daylight_Stallone.jpg,1996,12/6/1996,Disaster in a New York tunnel as explosions collapse both ends of it. One hero tries to help the people inside find their way to safety.
103,Escape from L.A.,John Carpenter,"Kurt Russell, Stacy Keach, Steve Buscemi",United States,//upload.wikimedia.org/wikipedia/en/7/71/Escape_From_LA.jpg,1996,8/9/1996,"Snake Plissken is once again called in by the United States government to recover a potential doomsday device from Los Angeles, now an autonomous island where undesirables are deported."
105,Ghost in the Shell,Mamoru Oshii,NULL,Japan,//upload.wikimedia.org/wikipedia/en/thumb/c/ca/Ghostintheshellposter.jpg/220px-Ghostintheshellposter.jpg,1995,11/18/1995,"In the near future, Major Mira Killian is the first of her kind: A human saved from a terrible crash, who is cyber-enhanced to be a perfect soldier devoted to stopping the world's most dangerous criminals."
106,God of Cookery,"Li Lik-Chi, Stephen Chow","Stephen Chow, Karen Mok, Nancy Sit",Hong Kong,//upload.wikimedia.org/wikipedia/en/thumb/9/9c/GodOfCookery.jpg/220px-GodOfCookery.jpg,1996,1996,"The most renowned and feared chef in the world loses his title of God of Cookery because of his pompous attitude. Humbled, he sets out to reclaim his title."
107,Independence Day,Roland Emmerich,"Will Smith, Bill Pullman, Jeff Goldblum",United States,//upload.wikimedia.org/wikipedia/en/thumb/b/bb/Independence_day_movieposter.jpg/220px-Independence_day_movieposter.jpg,1996,6/25/1996,"The aliens are coming and their goal is to invade and destroy Earth. Fighting superior technology, mankind's best weapon is the will to survive."
108,Iron Monkey 2,Zhao Lu Jiang,"Donnie Yen, Wu Ma, Billy Chow",Hong Kong,//upload.wikimedia.org/wikipedia/en/thumb/a/ad/Iron_Monkey_2.jpg/220px-Iron_Monkey_2.jpg,1996,4/27/1996,Donnie Yen fights a deadly assassin named Tiger Yu and teaming a band of insurrectionists battling a malevolent gang of weapons smugglers.
109,Last Man Standing,Walter Hill,"Bruce Willis, Christopher Walken, Bruce Dern",United States,//upload.wikimedia.org/wikipedia/en/thumb/a/a0/Last_man_standing_ver2.jpg/220px-Last_man_standing_ver2.jpg,1996,9/20/1996,A married father of three tries to maintain his manliness in a world increasingly dominated by women.
110,Maximum Risk,Ringo Lam,"Jean-Claude Van Damme, Natasha Henstridge",United States,//upload.wikimedia.org/wikipedia/en/thumb/f/fc/Maximum_Risk_Poster.jpg/220px-Maximum_Risk_Poster.jpg,1996,9/13/1996,"A cop/flic discovers that he had a twin who just got murdered in Nice, France. In order to find out who did it, he takes his place including the cute girlfriend in Little Odessa, NYC."
104,First Option,Gordon Chan,"Michael Wong, Gigi Leung, Damian Lau",Hong Kong,//upload.wikimedia.org/wikipedia/en/thumb/e/e9/FirstOption.jpg/220px-FirstOption.jpg,1996,9/14/1996,A volatile man (Michael Fitzgerald Wong) leads an elite team of commandos to search for a group of drug smugglers.
111,Police Story 4: First Strike,Stanley Tong,Jackie Chan,Hong KongUnited States,//upload.wikimedia.org/wikipedia/en/thumb/1/15/FirstStrike_Poster.jpg/220px-FirstStrike_Poster.jpg,1996,2/10/1996,This fourth installment of Chan's Police Story film franchise has our hero trying to locate a missing nuclear warhead.
113,The Glimmer Man,John Gray,"Steven Seagal, Keenen Ivory Wayans, Bob Gunton",United States,//upload.wikimedia.org/wikipedia/en/thumb/8/8c/Glimmer_man.jpg/220px-Glimmer_man.jpg,1996,10/4/1996,"Two cops are forced to work together to solve a chain of mysterious killings by a killer nicknamed ""The Family Man""."
114,The Long Kiss Goodnight,Renny Harlin,"Geena Davis, Samuel L. Jackson, Patrick Malahide",United States,//upload.wikimedia.org/wikipedia/en/thumb/f/f7/Long_kiss_goodnight_ver1.jpg/220px-Long_kiss_goodnight_ver1.jpg,1996,10/11/1996,"Samantha Caine lives in a small town with her daughter. Eight years ago she emerged, two months pregnant, from a nearby river with no memory of her past or who she is. However, she's getting closer to finding out about her past."
115,The Quest,Jean-Claude Van Damme,"Jean-Claude Van Damme, Roger Moore, James Remar",United States,//upload.wikimedia.org/wikipedia/en/thumb/9/9e/The_quest.jpg/220px-The_quest.jpg,1996,4/26/1996,"A group of gentlemen of fortune visits a legendary ""Lost City"", located in Tibet. They plan to steal a priceless statue ""Golden Dragon"" during the martial arts tournament."
116,The Rock,Michael Bay,"Nicolas Cage, Sean Connery, Ed Harris",United States,//upload.wikimedia.org/wikipedia/en/thumb/8/82/The_Rock_%28movie%29.jpg/220px-The_Rock_%28movie%29.jpg,1996,6/7/1996,"A mild-mannered chemist and an ex-con must lead the counterstrike when a rogue group of military men, led by a renegade general, threaten a nerve gas attack from Alcatraz against San Francisco."
117,Air Force One,Wolfgang Petersen,"Harrison Ford, Gary Oldman, Glenn Close",United States,//upload.wikimedia.org/wikipedia/en/thumb/2/2a/Air_Force_One_%28movie_poster%29.jpg/220px-Air_Force_One_%28movie_poster%29.jpg,1997,7/21/1997,"Communist Radicals hijack Air Force One with The U.S. President and his family on board. The Vice President negotiates from Washington D.C., while the President, a Veteran, fights to rescue the hostages on board."
118,Con Air,Simon West,"Nicolas Cage, John Cusack, John Malkovich",United States,//upload.wikimedia.org/wikipedia/en/thumb/1/1d/Conairinternational.jpg/220px-Conairinternational.jpg,1997,6/6/1997,Newly paroled ex-con and former U.S. Ranger Cameron Poe finds himself trapped in a prisoner transport plane when the passengers seize control.
