movie_id,movie,director,stars,country,url,release_year,released,plot
119,Conspiracy Theory,Richard Donner,"Mel Gibson, Julia Roberts, Patrick Stewart",United States,//upload.wikimedia.org/wikipedia/en/thumb/9/98/Conspiracy_theory_poster.jpg/220px-Conspiracy_theory_poster.jpg,1997,8/8/1997,"A taxi driver with a penchant for conspiracy theories becomes a target after one of these theories turns out to be true. Unfortunately, to save himself, he has to figure out which theory it is."
120,Drive,Steve Wang,"Mark Dacascos, Kadeem Hardison, Brittany Murphy",United States,//upload.wikimedia.org/wikipedia/en/thumb/8/87/Drive_%281997_film%29_poster.jpg/220px-Drive_%281997_film%29_poster.jpg,1997,8/4/1997,A mysterious Hollywood stuntman and mechanic moonlights as a getaway driver and finds himself in trouble when he helps out his neighbor in this action drama.
121,Fire Down Below,F�lix Enr�quez Alcal�,"Steven Seagal, Marg Helgenberger, Harry Dean Stanton",United States,//upload.wikimedia.org/wikipedia/en/thumb/3/33/Fire_Down_Below.jpg/220px-Fire_Down_Below.jpg,1997,9/5/1997,"Going undercover in rural Kentucky, an environmental agent tries to prove the dumping of toxic waste in the local coal mines by ruthless industrialists."
123,Metro,Thomas Carter,"Eddie Murphy, Michael Rapaport, Michael Wincott",United States,//upload.wikimedia.org/wikipedia/en/thumb/3/39/Metro_movie_eddie_murphy.jpg/220px-Metro_movie_eddie_murphy.jpg,1997,1/17/1997,A Hostage Negotiator teams up with a Sharpshooter to bring down a dangerous jewel thief.
124,Mortal Kombat: Annihilation,John R. Leonetti,"Robin Shou, Talisa Soto, James Remar",United States,//upload.wikimedia.org/wikipedia/en/thumb/9/9f/Mortal_kombat_annihilation.jpg/220px-Mortal_kombat_annihilation.jpg,1997,11/21/1997,A group of martial arts warriors have only six days to save the Earth from an extra-dimensional invasion.
125,Mr. Nice Guy,Sammo Hung,"Jackie Chan, Richard Norton, Gabrielle Fitzpatrick",Hong Kong,//upload.wikimedia.org/wikipedia/en/thumb/d/db/MrNiceGuy_DVDcover.jpg/220px-MrNiceGuy_DVDcover.jpg,1997,1/31/1997,"A Chinese chef accidentally gets involved with a news reporter who filmed a drug bust that went awry, and is now being chased by gangs who are trying to get the video tape."
126,Starship Troopers,Paul Verhoeven,"Casper Van Dien, Dina Meyer, Denise Richards",United States,//upload.wikimedia.org/wikipedia/en/thumb/d/df/Starship_Troopers_-_movie_poster.jpg/220px-Starship_Troopers_-_movie_poster.jpg,1997,11/7/1997,"Humans in a fascist, militaristic future wage war with giant alien bugs."
127,Steel,Kenneth Johnson,"Shaquille O'Neal, Annabeth Gish, Judd Nelson",United States,//upload.wikimedia.org/wikipedia/en/thumb/b/be/Steelposter.jpg/220px-Steelposter.jpg,1997,8/15/1997,A scientist for the military turns himself into a cartoon-like superhero when a version of one of his own weapons is being used against enemies.
128,Strategic Command,Rick Jacobson,"Michael Dudikoff, Paul Winfield, Richard Norton",United States,//upload.wikimedia.org/wikipedia/en/thumb/6/62/Strategic_Command_film_poster.jpg/220px-Strategic_Command_film_poster.jpg,1997,1997,"Rick Harding is a former Marines officer, now working in the FBI as a chemical weapons designer. While packing up for the night, a group of armed soldiers led by wanted criminal Carlos Gruber, break into the FBI research lab."
129,The Saint,Phillip Noyce,"Val Kilmer, Elisabeth Shue, Rade Serbedzija",United States,//upload.wikimedia.org/wikipedia/en/thumb/8/86/The_Saint_1997_poster.jpg/220px-The_Saint_1997_poster.jpg,1997,4/4/1997,"Simon Templar (The Saint), is a thief for hire, whose latest job to steal the secret process for cold fusion puts him at odds with a traitor bent on toppling the Russian government, as well as the woman who holds its secret."
171,Double Impact,Sheldon Lettich,"Jean-Claude Van Damme, Geoffrey Lewis, Alan Scarfe",United States,//upload.wikimedia.org/wikipedia/en/thumb/2/24/Double_impact.jpg/220px-Double_impact.jpg,1991,8/9/1991,Twin brothers are separated when their parents are murdered but 25 years later they re-unite in order to avenge their parents' death.
130,Tomorrow Never Dies,Roger Spottiswoode,"Pierce Brosnan, Jonathan Pryce, Michelle Yeoh",United States,//upload.wikimedia.org/wikipedia/en/thumb/b/b3/Tomorrow_Never_Dies_%28UK_cinema_poster%29.jpg/220px-Tomorrow_Never_Dies_%28UK_cinema_poster%29.jpg,1997,12/9/1997,James Bond sets out to stop a media mogul's plan to induce war between China and the U.K in order to obtain exclusive global media coverage.
131,Turbulence,Robert Butler,"Ray Liotta, Lauren Holly, Brendan Gleeson",United States,//upload.wikimedia.org/wikipedia/en/thumb/a/a5/Turbulence_poster.jpg/220px-Turbulence_poster.jpg,1997,1/10/1997,"After a shootout on a flight transporting prisoners, a flight attendant must outwit a smooth-talking serial killer and land the plane herself."
132,Volcano,Mick Jackson,"Tommy Lee Jones, Anne Heche, Gaby Hoffmann",United States,//upload.wikimedia.org/wikipedia/en/thumb/d/dd/Volcano_%281997_film%29.jpg/220px-Volcano_%281997_film%29.jpg,1997,4/25/1997,"A volcano erupts in downtown Los Angeles, threatening to destroy the city."
133,Armageddon,Michael Bay,"Bruce Willis, Billy Bob Thornton, Ben Affleck",United States,//upload.wikimedia.org/wikipedia/en/thumb/f/fc/Armageddon-poster06.jpg/220px-Armageddon-poster06.jpg,1998,7/1/1998,"After discovering that an asteroid the size of Texas is going to impact Earth in less than a month, NASA recruits a misfit team of deep-core drillers to save the planet."
136,Blade,Steve Norrington,"Wesley Snipes, Stephen Dorff, Kris Kristofferson",United States,//upload.wikimedia.org/wikipedia/en/thumb/1/19/Blade_movie.jpg/220px-Blade_movie.jpg,1998,8/21/1998,"A half-vampire, half-mortal man becomes a protector of the mortal race, while slaying evil vampires."
137,Desperate Measures,Barbet Schroeder,"Michael Keaton, Andy Garc�a, Brian Cox",United States,//upload.wikimedia.org/wikipedia/en/thumb/a/a1/Desperate_measures.jpg/220px-Desperate_measures.jpg,1998,1/30/1998,"Frank Conner is an honest police officer who desperately needs to save his son's life. However, after losing all hope, he finds out that a criminal Peter McCabe in jail is his only savior."
138,Enemy of the State,Tony Scott,"Will Smith, Gene Hackman, Jon Voight",United States,//upload.wikimedia.org/wikipedia/en/thumb/b/b2/Enemy_of_the_State_%28film%29_poster_art.jpg/220px-Enemy_of_the_State_%28film%29_poster_art.jpg,1998,11/20/1998,A lawyer becomes targeted by a corrupt politician and his N.S.A. goons when he accidentally receives key evidence to a politically motivated crime.
139,Knock Off,Tsui Hark,"Jean-Claude Van Damme, Rob Schneider, Lela Rochon",United StatesHong Kong,//upload.wikimedia.org/wikipedia/en/thumb/1/14/Knockoffposter.jpg/220px-Knockoffposter.jpg,1998,9/4/1998,A fashion designer must join forces with a C.I.A. agent to combat terrorism.
140,Lethal Weapon 4,Richard Donner,"Mel Gibson, Danny Glover, Joe Pesci",United States,//upload.wikimedia.org/wikipedia/en/thumb/a/a4/Lethal_Weapon_4_Poster.jpg/220px-Lethal_Weapon_4_Poster.jpg,1998,7/10/1998,"With personal crises and age weighing in on them, LAPD officers Riggs and Murtaugh must contend with deadly Chinese triads that are trying to free their former leaders out of prison and onto American soil."
141,Mercury Rising,Harold Becker,"Bruce Willis, Alec Baldwin, Miko Hughes",United States,//upload.wikimedia.org/wikipedia/en/thumb/a/a8/Mercuryrisingposter.jpg/220px-Mercuryrisingposter.jpg,1998,4/3/1998,Shadowy elements in the NSA target a nine-year old autistic savant for death when he is able to decipher a top secret code.
142,Point Blank,Matt Earl Beesley,"Mickey Rourke, Paul Ben-Victor, Danny Trejo",United States,//upload.wikimedia.org/wikipedia/en/4/49/Point_Blank_1998.jpg,1998,12/15/1998,An ER nurse and a career criminal are forced into an unlikely partnership in taking down a ring of corrupt cops threatening the lives of both their families.
143,Ronin,John Frankenheimer,"Robert De Niro, Jean Reno, Natascha McElhone",United States,//upload.wikimedia.org/wikipedia/en/7/78/Ronin_movie_1998.jpg,1998,9/12/1998,A freelancing former U.S. Intelligence Agent tries to track down a mysterious package that is wanted by the Irish and the Russians.
144,Rush Hour,Brett Ratner,"Chris Tucker, Jackie Chan, Tom Wilkinson",United States,//upload.wikimedia.org/wikipedia/en/thumb/4/49/Rush_Hour_poster.png/220px-Rush_Hour_poster.png,1998,9/18/1998,"A loyal and dedicated Hong Kong Inspector teams up with a reckless and loudmouthed L.A.P.D. detective to rescue the Chinese Consul's kidnapped daughter, while trying to arrest a dangerous crime lord along the way."
145,Small Soldiers,Joe Dante,"Frank Langella, Tommy Lee Jones, Ernest Borgnine",United States,//upload.wikimedia.org/wikipedia/en/thumb/8/85/Small_soldiers_movie_poster.jpg/220px-Small_soldiers_movie_poster.jpg,1998,6/4/1998,"When missile technology is used to enhance toy action figures, the toys soon begin to take their battle programming too seriously."
146,Taxi,G�rard Pir�s,"Samy Naceri, Frederic Diefenthal, Marion Cotillard",France,//upload.wikimedia.org/wikipedia/en/thumb/7/7e/TaxiPoster.jpg/220px-TaxiPoster.jpg,1998,4/8/1998,The staff of a New York City taxicab company go about their job while they dream of greater things.
147,The Big Hit,Che-Kirk Wong,"Mark Wahlberg, Lou Diamond Phillips, Christina Applegate",United States,//upload.wikimedia.org/wikipedia/en/thumb/e/e4/Big_hit.jpg/220px-Big_hit.jpg,1998,4/24/1998,"Socially anxious hitman Melvin Smiley, an expert in his lucrative field, goes on a job and falls in love with his kidnapping victim, turning his world upside down."
148,The Mask of Zorro,Martin Campbell,"Antonio Banderas, Anthony Hopkins, Catherine Zeta-Jones",United States,//upload.wikimedia.org/wikipedia/en/thumb/5/52/Mask_of_zorro.jpg/220px-Mask_of_zorro.jpg,1998,7/17/1998,"A young thief, seeking revenge for the death of his brother, is trained by the once great, but aged Zorro, who also pursues vengeance of his own."
149,The Siege,Edward Zwick,"Denzel Washington, Annette Bening, Bruce Willis",United States,//upload.wikimedia.org/wikipedia/en/thumb/9/96/Siege_movie_poster.jpg/220px-Siege_movie_poster.jpg,1998,11/6/1998,"The secret U.S. abduction of a suspected terrorist leads to a wave of terrorist attacks in New York City, which leads to the declaration of martial-law."
150,U.S. Marshals,Stuart Baird,"Tommy Lee Jones, Wesley Snipes, Robert Downey Jr.",United States,//upload.wikimedia.org/wikipedia/en/thumb/8/8a/U.S._Marshals_%28movie_poster%29.jpg/220px-U.S._Marshals_%28movie_poster%29.jpg,1998,3/6/1998,"U.S. Marshal Samuel Gerard and his team of Marshals are assigned to track down Sheridan, who has been accused of a double-murder."
135,Beast Cops,"Gordon Chan, Dante Lam","Michael Wong, Anthony Wong, Kathy Chau",Hong Kong,//upload.wikimedia.org/wikipedia/en/thumb/8/8d/BeastCops.jpg/220px-BeastCops.jpg,1998,4/9/1998,"Hong Kong action drama about the redemption of a corrupt, lazy detective, who finds himself drawn away from the sleaze and bribery of his former life by the youthful idealism of his new boss."
151,Vampires,John Carpenter,"James Woods, Daniel Baldwin, Sheryl Lee",United States,//upload.wikimedia.org/wikipedia/en/thumb/8/84/Vampires_%281998%29_poster.jpg/250px-Vampires_%281998%29_poster.jpg,1998,10/30/1998,"Recovering from an ambush that killed his entire team, a vengeful vampire slayer must retrieve an ancient Catholic relic that, should it be acquired by vampires, will allow them to walk in sunlight."
152,Who Am I?,"Jackie Chan, Benny Chan","Jackie Chan, Michelle Ferre, Mirai Yamamoto",Hong Kong,//upload.wikimedia.org/wikipedia/en/thumb/0/00/WhoAmIJackieChan.jpg/220px-WhoAmIJackieChan.jpg,1998,1/17/1998,"A Secret Agent loses his memory after falling from a crashing helicopter. He is then chased by several other agency operatives, but he has no idea why."
153,Young and Dangerous 5,Andrew Lau,"Ekin Cheng, Paul Chiang",Hong Kong,//upload.wikimedia.org/wikipedia/en/thumb/4/4c/YoungAndDangerous5.jpg/220px-YoungAndDangerous5.jpg,1998,1/8/1998,"Youth Teen Fashion, Lifestyle, Sports, Music, Variety and Entertainment"
154,Dead or Alive,Takashi Miike,"Riki Takeuchi, Show Aikawa, Renji Ishibashi",Japan,//upload.wikimedia.org/wikipedia/en/thumb/6/6c/Dead-or-alive-1999-poster.jpg/220px-Dead-or-alive-1999-poster.jpg,1999,11/27/1999,A yakuza of Chinese descent and a Japanese cop each wage their own war against the Japanese mafia. But they are destined to meet. Their encounter will change the world.
155,Gen-X Cops,Benny Chan,"Toru Nakamura, Eric Tsang, Daniel Wu",Hong Kong,//upload.wikimedia.org/wikipedia/en/thumb/0/07/Gen-X-Cops-poster.jpg/220px-Gen-X-Cops-poster.jpg,1999,6/18/1999,"A ridiculed HK cop hires 3 cadets, directly (thrown) out of police academy, to go undercover and get the criminals, who stole explosives and killed his partner."
156,Gorgeous,Vincent Kok,"Jackie Chan, Shu Qi, Tony Leung Chiu-Wai",Hong Kong,//upload.wikimedia.org/wikipedia/en/thumb/f/f5/GorgeousPoster.jpg/220px-GorgeousPoster.jpg,1999,2/12/1999,A romantic girl travels to Hong Kong in search of certain love but instead meets a kind-hearted professional fighter for whom she begins to fall instead.
158,The Matrix,"Andy Wachowski, Larry Wachowski","Keanu Reeves, Laurence Fishburne, Carrie-Anne Moss",United States,//upload.wikimedia.org/wikipedia/en/thumb/c/c1/The_Matrix_Poster.jpg/220px-The_Matrix_Poster.jpg,1999,3/31/1999,A computer hacker learns from mysterious rebels about the true nature of his reality and his role in the war against its controllers.
159,Fatal Termination,Andrew Kam,"Moon Lee, Robin Shou",Hong Kong,https://asianwiki.com/images/0/06/Fatal_Termination.jpg,1990,1990,A Hong Kong police officer's wife seeks revenge when a ruthless munitions smuggler kidnaps her daughter.
160,The World Is Not Enough,Michael Apted,"Pierce Brosnan, Sophie Marceau, Robert Carlyle",United StatesUnited Kingdom,//upload.wikimedia.org/wikipedia/en/thumb/0/0c/The_World_Is_Not_Enough_%28UK_cinema_poster%29.jpg/220px-The_World_Is_Not_Enough_%28UK_cinema_poster%29.jpg,1999,11/8/1999,"James Bond uncovers a nuclear plot while protecting an oil heiress from her former kidnapper, an international terrorist who can't feel pain."
161,Victim,Ringo Lam,"Lau Ching-Wan, Amy Kwok, Tony Leung Kar-Fai",Hong Kong,//upload.wikimedia.org/wikipedia/en/thumb/f/f9/Victim-poster.jpg/220px-Victim-poster.jpg,1999,10/16/1999,A closeted lawyer risks his career to bring a blackmailer to justice.
163,Air America,Roger Spottiswoode,"Mel Gibson, Robert Downey Jr., Nancy Travis",United States,//upload.wikimedia.org/wikipedia/en/thumb/1/11/Air_America_%28film%29.jpg/200px-Air_America_%28film%29.jpg,1990,8/10/1990,A young pilot finds himself recruited unwittingly into a covert and corrupt C.I.A. airlift organization operating in Vietnam War-era Laos.
164,Blue Steel,Kathryn Bigelow,"Jamie Lee Curtis, Ron Silver, Clancy Brown",United States,//upload.wikimedia.org/wikipedia/en/thumb/3/37/Blue_Steel_%281990_film%29.jpg/220px-Blue_Steel_%281990_film%29.jpg,1990,1990-01,A rookie in the police force must engage in a cat-and-mouse game with a pistol-wielding psychopath who becomes obsessed with her.
165,China O'Brien,Robert Clouse,"Cynthia Rothrock, Richard Norton, Keith Cooke",United States,//upload.wikimedia.org/wikipedia/en/thumb/e/ec/China_O%27Brien.jpg/220px-China_O%27Brien.jpg,1988,1991,"A police woman, expert and instructor in martial arts, leaves the city to stay with her dad, sheriff in a town with peace and quiet - or so she thinks. She gets plenty opportunities to show her martial arts skills."
166,Curry and Pepper,Blackie Ko,"Ann Bridgewater, Jacky Cheung, Stephen Chow",Hong Kong,//upload.wikimedia.org/wikipedia/en/thumb/a/a3/CurryandPepper.jpg/220px-CurryandPepper.jpg,1990,5/24/1990,Two best friends and cop partners become the subject of a beautiful news reporter's documentary. The two soon find themselves competing for screen time as well as the love of the reporter while after a murderous arms dealer.
167,RoboCop 2,Irvin Kershner,"Peter Weller, Nancy Allen, Dan O'Herlihy",United States,//upload.wikimedia.org/wikipedia/en/thumb/f/fe/Robo2poster.png/220px-Robo2poster.png,1990,6/22/1990,"Cyborg law enforcer RoboCop returns to protect the citizens of old Detroit but faces a deadly challenge when a rogue OCP member secretly creates a new, evil RoboCop 2."
168,Short Time,Gregg Champion,"Dabney Coleman, Matt Frewer, Teri Garr",United States,//upload.wikimedia.org/wikipedia/en/thumb/8/82/Shorttimeposter.jpg/220px-Shorttimeposter.jpg,1990,5/4/1990,"When a police detective thinks he is dying and learns that his life insurance pays out more if he dies in the line of duty, he tries to make that happen."
170,Backdraft,Ron Howard,"Kurt Russell, William Baldwin, Robert De Niro",United States,//upload.wikimedia.org/wikipedia/en/thumb/a/a1/Backdraft_poster.jpg/220px-Backdraft_poster.jpg,1991,5/24/1991,"Two Chicago firefighter brothers, who don't get along, have to work together while a dangerous arsonist is on the loose."
172,Fist of Fury 1991,Joh Chung Sing,"Stephen Chow, Kenny Bee, Cheung Man",Hong Kong,//upload.wikimedia.org/wikipedia/en/thumb/6/65/First-of-fury-1991.jpg/220px-First-of-fury-1991.jpg,1991,3/23/1991,A mainlander comes to Hong Kong to find his cousin in this spinoff to the 1972 Bruce Lee classic.
162,Zero Tolerance,Anders Nilsson,"Jakob Eklund, Marie Richardson",Sweden,//upload.wikimedia.org/wikipedia/en/2/29/Noll_tolerans_dvd_cover.jpg,1999,10/29/1999,A police officer tries to clear his name of false charges while staying a step ahead of those who want him dead.
173,McBain,James Glickenhaus,"Christopher Walken, Michael Ironside, Steve James",United States,//upload.wikimedia.org/wikipedia/en/thumb/a/af/McBain_FilmPoster.jpeg/220px-McBain_FilmPoster.jpeg,1991,9/20/1991,A former Vietnam War lieutenant reforms his old team in order to help a revolutionary's sister overthrow a ruthless dictator.
174,Out for Justice,John Flynn,"Steven Seagal, William Forsythe, Jerry Orbach",United States,//upload.wikimedia.org/wikipedia/en/thumb/e/e9/OutforJustice91.jpg/220px-OutforJustice91.jpg,1991,4/12/1991,The gruesome murder of a Brooklyn Detective will turn the case into a personal vendetta when the deceased's best friend and fellow officer will unleash an all-out attack against a psychotic Mafia enforcer's brutal gang.
175,Ricochet,Russell Mulcahy,"Denzel Washington, John Lithgow, Ice-T",United States,//upload.wikimedia.org/wikipedia/en/thumb/a/ad/Ricochet_ver2.jpg/220px-Ricochet_ver2.jpg,1991,10/4/1991,A District Attorney is terrorized by the criminal he put away years ago when he was a cop.
176,The Hard Way,John Badham,"Michael J. Fox, James Woods, Annabella Sciorra",United States,//upload.wikimedia.org/wikipedia/en/thumb/8/83/The_hard_way_poster.jpg/220px-The_hard_way_poster.jpg,1991,3/8/1991,"After learning his brother died on a mission in Romania, a former soldier teams up with two allies to hunt down a mysterious enemy and exact revenge."
177,The Rocketeer,Joe Johnston,"Billy Campbell, Jennifer Connelly, Alan Arkin",United States,//upload.wikimedia.org/wikipedia/en/thumb/c/cc/Rocketeermovieposter.jpg/220px-Rocketeermovieposter.jpg,1991,6/21/1991,A young pilot stumbles onto a prototype jetpack that allows him to become a high-flying masked hero.
179,Trancers II,Charles Band,"Tim Thomerson, Helen Hunt, Megan Ward",United States,//upload.wikimedia.org/wikipedia/en/thumb/0/0a/TrancersII.jpg/220px-TrancersII.jpg,1991,8/22/1991,"6 years after a time cop returns home from battling future alien zombies, his settled life is turned upside down when a mad scientists creates more."
181,Batman Returns,Tim Burton,"Michael Keaton, Danny DeVito, Michelle Pfeiffer",United States,//upload.wikimedia.org/wikipedia/en/8/83/Batman_returns_poster2.jpg,1992,6/16/1992,Batman returns to the big screen when a deformed man calling himself the Penguin wreaks havoc across Gotham with the help of a cruel businessman.
182,Freejack,Geoff Murphy,"Emilio Estevez, Mick Jagger, Anthony Hopkins",United States,//upload.wikimedia.org/wikipedia/en/b/be/Freejack.jpg,1992,1/17/1992,"Bounty hunters from the future transport a doomed race car driver to New York City in 2009, where his mind will be replaced with that of a dead billionaire."
183,Full Contact,Ringo Lam,"Chow Yun-fat, Ann Bridgewater, Frankie Chin",Hong Kong,//upload.wikimedia.org/wikipedia/en/thumb/0/07/FullContact.jpg/220px-FullContact.jpg,1992,7/23/1992,Two disreputable friends get tied in with a group of criminals who turn out to be excessively violent and deceptive.
184,Kuffs,Bruce A. Evans,"Christian Slater, Tony Goldwyn, Milla Jovovich",United States,//upload.wikimedia.org/wikipedia/en/thumb/0/04/Kuffs.jpg/220px-Kuffs.jpg,1992,1/10/1992,"George Kuffs, 21, leaves a pregnant girlfriend. He visits his brother Brad to bum money off him. Brad's shot and George IDs the killer at SFPD but to no avail. He inherits Brad's patrol district. He keeps it to get the killer."
185,Naked Killer,Clarence Fok,"Carrie Ng, Kelly Yao, Yau Chingmy",Hong Kong,//upload.wikimedia.org/wikipedia/en/thumb/8/8f/Naked_Killer_DVD_Cover.jpg/220px-Naked_Killer_DVD_Cover.jpg,1992,1992,A young woman is trained by a martial arts specialist to become a professional assassin.
186,Police Story 3: Super Cop,Stanley Tong,"Jackie Chan, Michelle Yeoh, Maggie Cheung",Hong Kong,//upload.wikimedia.org/wikipedia/en/thumb/5/5a/Policestory_poster.jpg/220px-Policestory_poster.jpg,1992,7/4/1992,A Hong Kong detective teams up with his female Red Chinese counterpart to stop a Chinese drug czar.
187,Rapid Fire,Dwight H. Little,"Brandon Lee, Powers Boothe, Nick Mancuso",United States,//upload.wikimedia.org/wikipedia/en/thumb/c/c5/Rapid_fire_ver1.jpg/220px-Rapid_fire_ver1.jpg,1992,8/21/1992,"When student Jake Lo witnesses a killing, he finds himself caught between two feuding drug lords. Betrayed and set up by the federal agents, the only person he can trust is Ryan, a Chicago cop who reminds Jake of his deceased father."
188,Sneakers,Phil Alden Robinson,"Robert Redford, Sidney Poitier, Ben Kingsley",United States,//upload.wikimedia.org/wikipedia/en/thumb/a/aa/Sneakersmovie.jpg/220px-Sneakersmovie.jpg,1992,9/11/1992,"A security pro finds his past coming back to haunt him, when he and his unique team are tasked with retrieving a particularly important item."
190,Butterfly and Sword,Michael Mak,"Donnie Yen, Michelle Yeoh, Tony Leung Chiu-Wai",Hong Kong,//upload.wikimedia.org/wikipedia/en/thumb/b/b9/Butterfly-sword-poster.jpg/220px-Butterfly-sword-poster.jpg,1993,1/16/1993,Dynamo Michelle Yeoh stars as a loyalist who attempts to keep the King's empire from being overthrown by a revolutionary group.
191,Demolition Man,Marco Brambilla,"Sylvester Stallone, Wesley Snipes, Sandra Bullock",United States,//upload.wikimedia.org/wikipedia/en/thumb/0/05/Demolition_man.jpg/220px-Demolition_man.jpg,1993,10/8/1993,A police officer is brought out of suspended animation in prison to pursue an old ultra-violent nemesis who is loose in a non-violent future society.
192,Fortress,Stuart Gordon,"Christopher Lambert, Loryn Locklin, Kurtwood Smith",AustraliaUnited States,//upload.wikimedia.org/wikipedia/en/thumb/9/93/Fortressposter.jpg/220px-Fortressposter.jpg,1992,12/18/1992,"In a future, private underground prison/Fortress, the inmates are computer controlled with CCTV, dream readers and devices that can cause pain or death. John and his illegally pregnant wife are inside but want to escape before birth."
193,Joshua Tree,Vic Armstrong,"Dolph Lundgren, Kristian Alfonso, George Segal",United States,//upload.wikimedia.org/wikipedia/en/thumb/c/c7/JoshueTree93.jpg/220px-JoshueTree93.jpg,1993,3/27/1993,A Los Angeles police detective (George Segal) tracks a fugitive (Dolph Lundgren) who heads for the desert with a deputy sheriff (Kristian Alfonso) as hostage.
189,Mutant Action,Alex de la Iglesia,"Antonio Resines, Frederique Feder, Alex Angulo",Spain,//upload.wikimedia.org/wikipedia/en/thumb/a/a9/Accionmutante.jpg/220px-Accionmutante.jpg,1993,1993,"In a future ruled by attractive people, mutant terrorists kidnap a rich man's daughter to claim rights for the ugly. Escaping police, the mutant leader crashes into a planet of crazy miners where no women live."
180,American Samurai,Sam Firstenberg,"David Bradley, Mark Dacascos, John Fujioka",United States,https://encrypted-tbn1.gstatic.com/images?q=tbn:ANd9GcQAwpsLT4oy_LopFQhQx1RXx5lMDbi1UHrUe-3iRKpCycE4g3Vm,1992,1992,"An American reporter teams up with a martial arts expert, whose half-brother is a ""yakuza"" - Japanese mafia - drug dealer to battle swordsmen from around the world in a Turkish arena."
195,Last Hero in China,Wong Jing,Jet Li,Hong Kong,//upload.wikimedia.org/wikipedia/en/thumb/7/74/Last_Hero_In_China_DVDcover.jpg/220px-Last_Hero_In_China_DVDcover.jpg,1993,4/1/1993,"Jet Li stars in this comic spectacle as a Chinese ""Robin Hood"" who stumbles upon a kidnapping scheme after unwittingly opening a martial arts school next to a brothel!"
196,Sniper,Luis Llosa,"Tom Berenger, Billy Zane, J.T. Walsh",United States,//upload.wikimedia.org/wikipedia/en/thumb/4/40/Sniper_poster.jpg/220px-Sniper_poster.jpg,1993,1/29/1993,A US Marine sniper is partnered with a SWAT member to take out rebel leaders in the jungles of Panama.
197,Striking Distance,Rowdy Herrington,"Bruce Willis, Sarah Jessica Parker, Dennis Farina",United States,//upload.wikimedia.org/wikipedia/en/thumb/3/38/Striking_distance.jpg/220px-Striking_distance.jpg,1993,9/17/1993,"Coming from a police family, Tom Hardy ends up fighting his uncle after the murder of his father. Tom believes the killer is another cop and goes on the record with his allegations. Demoted then to river duty, the killer taunts Tom."
